{"key":"content:fr:docs:2.concepts:5.nuxt-lifecycle.md","generatedAt":"2022-03-15T12:18:24.085Z","mtime":"2022-03-15T12:18:24.063Z","slug":"nuxt-lifecycle","title":"Cycles de vie de Nuxt","position":"999900020005","to":"/docs/concepts/nuxt-lifecycle","draft":false,"page":true,"language":"fr","description":"Peu importe l'outil que nous utilisons, nous serons davantage en confiance lorsque nous serons capable de comprendre comment il marche dans les détails. Il en est de même pour Nuxt.","category":"concepts","empty":false,"body":{"raw":"---\ntitle: Cycles de vie de Nuxt\ndescription: Peu importe l'outil que nous utilisons, nous serons davantage en confiance lorsque nous serons capable de comprendre comment il marche dans les détails. Il en est de même pour Nuxt.\ncategory: concepts\n---\n# Cycles de vie de Nuxt\n\nPeu importe l'outil que nous utilisons, nous serons davantage en confiance lorsque nous serons capable de comprendre comment il marche dans les détails. Il en est de même pour Nuxt. Le but de ce chapitre est de nous donner une vue d'ensemble des différentes parties du framework, leur ordre d'exécution ainsi que la façon dont ils intéragissent entre eux.\n\n---\n\n![Les lifecycles de Nuxt 2.12](/img/docs/nuxt-lifecycle.svg)\n\n\nLe cycle de vie de Nuxt décrit les différentes étapes qui ont lieu après la phase de build, une fois que notre application a été bundlée, chunkée et minifiée. Ce qu'il se passe après cette phase dépend de si nous avons activé le rendu côté serveur ou pas. Si c'est le cas, il faut ensuite regarder le type de rendu serveur que nous avons choisi:\n\nRendu dynamique côté serveur (SSR) (`nuxt start`)\n\nou Génération statique de site (SSG) (`nuxt generate`).\n\n## Cycle de vie\n\n### Serveur\n\nPour le SSR, les étapes suivantes seront exécutées pour chaque requête sur notre app\n\n- Le serveur démarre (`nuxt start`)\n\nLorsque nous utilisons la génération statique de notre site, les étapes qui ont lieu sur le serveur ne seront exécutées que lors de la phase de build et une fois pour chaque page générée.\n\n- Le processus de génération commence (`nuxt generate`)\n\n- Hooks Nuxt\n- serverMiddleware\n- Les plugins de Nuxt côté serveur\n  - en suivant l'ordre défini dans nuxt.config.js\n- nuxtServerInit\n  - action Vuex qui est appelée seulement côté serveur pour pré-remplir le store\n  - le premier argument dans le **context de Vuex**, le second argument dans le **context de Nuxt**\n    - on dispatch les autres actions d'ici → c'est seulement le \"point d'entrée\" pour des actions ultérieures du côté serveur\n  - peut seulement être défini dans le `store/index.js`\n- Middleware\n  - Global middleware\n  - Layout middleware\n  - Route middleware\n- asyncData\n- beforeCreate (cycle de vie de Vue)\n- created (cycle de vie de Vue)\n- Le nouveau fetch (du haut vers le bas, en parallèle si ce sont des voisins)\n- Sérialisation du state (hook `render:routeContext` de Nuxt)\n\n- le rendu HTML commence (hook `render:route` de Nuxt)\n\n- `render:routeDone` hook quand le HTML a été envoyé au navigateur\n\n- `generate:before` hook de Nuxt\n- les fichiers HTML sont générés\n  - **génération intégralement statique**\n    - ex. les payloads statiques sont extraits\n  - `generate:page` (HTML éditable)\n  - `generate:routeCreated` (Route générée)\n- `generate:done` quand tous les fichiers HTML ont été générés\n\n### Client\n\nCette partie du cycle est entièrement exécutée dans le navigateur, peu importe le mode que nous avons choisi pour Nuxt.\n\n- Reçoit le HTML\n- Charge les ressources (ex. Javascript)\n- Hydratation de Vue\n- Middleware\n  - Global middleware\n  - Layout middleware\n  - Route middleware\n- asyncData (bloquant)\n- plugins clients de Nuxt\n  - en suivant l'ordre défini dans nuxt.config.js\n- beforeCreate (méthode du cycle de vie de Vue)\n- created (méthode du cycle de vie de Vue)\n- Le nouveau fetch (du haut vers le bas, en parallèle si ce sont des voisins)\n- beforeMount (méthode du cycle de vie de Vue)\n- mounted (méthode du cycle de vie de Vue)\n\n### Naviguer en utilisant le composant NuxtLink\n\nDe la même façon que pour la partie _client_, tout se passe dans le navigateur mais seulement lors d'une navigation avec `<NuxtLink>`. De plus, aucun contenu n'est affiché sur la page tant qu'il reste des tâches _bloquantes_.\n\n::alert{type=\"info\"}\n\nSe référer au chapitre sur les composants pour plus d'informations sur [`<NuxtLink>`](/docs/features/nuxt-components#the-nuxtlink-component).\n\n::\n\n- middleware (bloquant)\n  - Global middleware\n  - Layout middleware\n  - Route middleware\n- asyncData (bloquant)\n- asyncData (bloquant) [ou chargement entièrement statique du payload]\n- beforeCreate & created (méthode du cycle de vie de Vue)\n- fetch (non-bloquant)\n- beforeMount & mounted\n\n### Ensuite ?\n\n::alert{type=\"next\"}\n\nPlus d'informations dans le [recueil sur les features](/docs/features/rendering-modes).\n\n::\n","ast":{"type":"root","children":[{"type":"element","tag":"prose-h1","props":{"class":"d-heading-title","id":"cycles-de-vie-de-nuxt"},"children":[{"type":"text","value":"Cycles de vie de Nuxt"}]},{"type":"text","value":"\n"},{"type":"element","tag":"prose-paragraph","props":{"class":"d-heading-description"},"children":[{"type":"text","value":"Peu importe l'outil que nous utilisons, nous serons davantage en confiance lorsque nous serons capable de comprendre comment il marche dans les détails. Il en est de même pour Nuxt. Le but de ce chapitre est de nous donner une vue d'ensemble des différentes parties du framework, leur ordre d'exécution ainsi que la façon dont ils intéragissent entre eux."}]},{"type":"text","value":"\n"},{"type":"element","tag":"prose-hr","props":{"class":"d-heading-hr"},"children":[]},{"type":"text","value":"\n"},{"type":"element","tag":"prose-paragraph","props":{},"children":[{"type":"element","tag":"prose-img","props":{"alt":"Les lifecycles de Nuxt 2.12","src":"/img/docs/nuxt-lifecycle.svg"},"children":[]}]},{"type":"text","value":"\n"},{"type":"element","tag":"prose-paragraph","props":{},"children":[{"type":"text","value":"Le cycle de vie de Nuxt décrit les différentes étapes qui ont lieu après la phase de build, une fois que notre application a été bundlée, chunkée et minifiée. Ce qu'il se passe après cette phase dépend de si nous avons activé le rendu côté serveur ou pas. Si c'est le cas, il faut ensuite regarder le type de rendu serveur que nous avons choisi:"}]},{"type":"text","value":"\n"},{"type":"element","tag":"prose-paragraph","props":{},"children":[{"type":"text","value":"Rendu dynamique côté serveur (SSR) ("},{"type":"element","tag":"prose-code-inline","props":{},"children":[{"type":"text","value":"nuxt start"}]},{"type":"text","value":")"}]},{"type":"text","value":"\n"},{"type":"element","tag":"prose-paragraph","props":{},"children":[{"type":"text","value":"ou Génération statique de site (SSG) ("},{"type":"element","tag":"prose-code-inline","props":{},"children":[{"type":"text","value":"nuxt generate"}]},{"type":"text","value":")."}]},{"type":"text","value":"\n"},{"type":"element","tag":"prose-h2","props":{"id":"cycle-de-vie"},"children":[{"type":"element","tag":"prose-a","props":{"href":"#cycle-de-vie"},"children":[{"type":"text","value":"Cycle de vie"}]}]},{"type":"text","value":"\n"},{"type":"element","tag":"prose-h3","props":{"id":"serveur"},"children":[{"type":"element","tag":"prose-a","props":{"href":"#serveur"},"children":[{"type":"text","value":"Serveur"}]}]},{"type":"text","value":"\n"},{"type":"element","tag":"prose-paragraph","props":{},"children":[{"type":"text","value":"Pour le SSR, les étapes suivantes seront exécutées pour chaque requête sur notre app"}]},{"type":"text","value":"\n"},{"type":"element","tag":"prose-ul","props":{},"children":[{"type":"text","value":"\n"},{"type":"element","tag":"prose-li","props":{},"children":[{"type":"text","value":"\n"},{"type":"text","value":"Le serveur démarre ("},{"type":"element","tag":"prose-code-inline","props":{},"children":[{"type":"text","value":"nuxt start"}]},{"type":"text","value":")"},{"type":"text","value":"\n"}]},{"type":"text","value":"\n"}]},{"type":"text","value":"\n"},{"type":"element","tag":"prose-paragraph","props":{},"children":[{"type":"text","value":"Lorsque nous utilisons la génération statique de notre site, les étapes qui ont lieu sur le serveur ne seront exécutées que lors de la phase de build et une fois pour chaque page générée."}]},{"type":"text","value":"\n"},{"type":"element","tag":"prose-ul","props":{},"children":[{"type":"text","value":"\n"},{"type":"element","tag":"prose-li","props":{},"children":[{"type":"text","value":"\n"},{"type":"text","value":"Le processus de génération commence ("},{"type":"element","tag":"prose-code-inline","props":{},"children":[{"type":"text","value":"nuxt generate"}]},{"type":"text","value":")"},{"type":"text","value":"\n"}]},{"type":"text","value":"\n"},{"type":"element","tag":"prose-li","props":{},"children":[{"type":"text","value":"\n"},{"type":"text","value":"Hooks Nuxt"},{"type":"text","value":"\n"}]},{"type":"text","value":"\n"},{"type":"element","tag":"prose-li","props":{},"children":[{"type":"text","value":"\n"},{"type":"text","value":"serverMiddleware"},{"type":"text","value":"\n"}]},{"type":"text","value":"\n"},{"type":"element","tag":"prose-li","props":{},"children":[{"type":"text","value":"\n"},{"type":"text","value":"Les plugins de Nuxt côté serveur"},{"type":"text","value":"\n"},{"type":"element","tag":"prose-ul","props":{},"children":[{"type":"text","value":"\n"},{"type":"element","tag":"prose-li","props":{},"children":[{"type":"text","value":"\n"},{"type":"text","value":"en suivant l'ordre défini dans nuxt.config.js"},{"type":"text","value":"\n"}]},{"type":"text","value":"\n"}]},{"type":"text","value":"\n"}]},{"type":"text","value":"\n"},{"type":"element","tag":"prose-li","props":{},"children":[{"type":"text","value":"\n"},{"type":"text","value":"nuxtServerInit"},{"type":"text","value":"\n"},{"type":"element","tag":"prose-ul","props":{},"children":[{"type":"text","value":"\n"},{"type":"element","tag":"prose-li","props":{},"children":[{"type":"text","value":"\n"},{"type":"text","value":"action Vuex qui est appelée seulement côté serveur pour pré-remplir le store"},{"type":"text","value":"\n"}]},{"type":"text","value":"\n"},{"type":"element","tag":"prose-li","props":{},"children":[{"type":"text","value":"\n"},{"type":"text","value":"le premier argument dans le "},{"type":"element","tag":"prose-strong","props":{},"children":[{"type":"text","value":"context de Vuex"}]},{"type":"text","value":", le second argument dans le "},{"type":"element","tag":"prose-strong","props":{},"children":[{"type":"text","value":"context de Nuxt"}]},{"type":"text","value":"\n"},{"type":"element","tag":"prose-ul","props":{},"children":[{"type":"text","value":"\n"},{"type":"element","tag":"prose-li","props":{},"children":[{"type":"text","value":"\n"},{"type":"text","value":"on dispatch les autres actions d'ici → c'est seulement le \"point d'entrée\" pour des actions ultérieures du côté serveur"},{"type":"text","value":"\n"}]},{"type":"text","value":"\n"}]},{"type":"text","value":"\n"}]},{"type":"text","value":"\n"},{"type":"element","tag":"prose-li","props":{},"children":[{"type":"text","value":"\n"},{"type":"text","value":"peut seulement être défini dans le "},{"type":"element","tag":"prose-code-inline","props":{},"children":[{"type":"text","value":"store/index.js"}]},{"type":"text","value":"\n"}]},{"type":"text","value":"\n"}]},{"type":"text","value":"\n"}]},{"type":"text","value":"\n"},{"type":"element","tag":"prose-li","props":{},"children":[{"type":"text","value":"\n"},{"type":"text","value":"Middleware"},{"type":"text","value":"\n"},{"type":"element","tag":"prose-ul","props":{},"children":[{"type":"text","value":"\n"},{"type":"element","tag":"prose-li","props":{},"children":[{"type":"text","value":"\n"},{"type":"text","value":"Global middleware"},{"type":"text","value":"\n"}]},{"type":"text","value":"\n"},{"type":"element","tag":"prose-li","props":{},"children":[{"type":"text","value":"\n"},{"type":"text","value":"Layout middleware"},{"type":"text","value":"\n"}]},{"type":"text","value":"\n"},{"type":"element","tag":"prose-li","props":{},"children":[{"type":"text","value":"\n"},{"type":"text","value":"Route middleware"},{"type":"text","value":"\n"}]},{"type":"text","value":"\n"}]},{"type":"text","value":"\n"}]},{"type":"text","value":"\n"},{"type":"element","tag":"prose-li","props":{},"children":[{"type":"text","value":"\n"},{"type":"text","value":"asyncData"},{"type":"text","value":"\n"}]},{"type":"text","value":"\n"},{"type":"element","tag":"prose-li","props":{},"children":[{"type":"text","value":"\n"},{"type":"text","value":"beforeCreate (cycle de vie de Vue)"},{"type":"text","value":"\n"}]},{"type":"text","value":"\n"},{"type":"element","tag":"prose-li","props":{},"children":[{"type":"text","value":"\n"},{"type":"text","value":"created (cycle de vie de Vue)"},{"type":"text","value":"\n"}]},{"type":"text","value":"\n"},{"type":"element","tag":"prose-li","props":{},"children":[{"type":"text","value":"\n"},{"type":"text","value":"Le nouveau fetch (du haut vers le bas, en parallèle si ce sont des voisins)"},{"type":"text","value":"\n"}]},{"type":"text","value":"\n"},{"type":"element","tag":"prose-li","props":{},"children":[{"type":"text","value":"\n"},{"type":"text","value":"Sérialisation du state (hook "},{"type":"element","tag":"prose-code-inline","props":{},"children":[{"type":"text","value":"render:routeContext"}]},{"type":"text","value":" de Nuxt)"},{"type":"text","value":"\n"}]},{"type":"text","value":"\n"},{"type":"element","tag":"prose-li","props":{},"children":[{"type":"text","value":"\n"},{"type":"text","value":"le rendu HTML commence (hook "},{"type":"element","tag":"prose-code-inline","props":{},"children":[{"type":"text","value":"render:route"}]},{"type":"text","value":" de Nuxt)"},{"type":"text","value":"\n"}]},{"type":"text","value":"\n"},{"type":"element","tag":"prose-li","props":{},"children":[{"type":"text","value":"\n"},{"type":"element","tag":"prose-code-inline","props":{},"children":[{"type":"text","value":"render:routeDone"}]},{"type":"text","value":" hook quand le HTML a été envoyé au navigateur"},{"type":"text","value":"\n"}]},{"type":"text","value":"\n"},{"type":"element","tag":"prose-li","props":{},"children":[{"type":"text","value":"\n"},{"type":"element","tag":"prose-code-inline","props":{},"children":[{"type":"text","value":"generate:before"}]},{"type":"text","value":" hook de Nuxt"},{"type":"text","value":"\n"}]},{"type":"text","value":"\n"},{"type":"element","tag":"prose-li","props":{},"children":[{"type":"text","value":"\n"},{"type":"text","value":"les fichiers HTML sont générés"},{"type":"text","value":"\n"},{"type":"element","tag":"prose-ul","props":{},"children":[{"type":"text","value":"\n"},{"type":"element","tag":"prose-li","props":{},"children":[{"type":"text","value":"\n"},{"type":"element","tag":"prose-strong","props":{},"children":[{"type":"text","value":"génération intégralement statique"}]},{"type":"text","value":"\n"},{"type":"element","tag":"prose-ul","props":{},"children":[{"type":"text","value":"\n"},{"type":"element","tag":"prose-li","props":{},"children":[{"type":"text","value":"\n"},{"type":"text","value":"ex. les payloads statiques sont extraits"},{"type":"text","value":"\n"}]},{"type":"text","value":"\n"}]},{"type":"text","value":"\n"}]},{"type":"text","value":"\n"},{"type":"element","tag":"prose-li","props":{},"children":[{"type":"text","value":"\n"},{"type":"element","tag":"prose-code-inline","props":{},"children":[{"type":"text","value":"generate:page"}]},{"type":"text","value":" (HTML éditable)"},{"type":"text","value":"\n"}]},{"type":"text","value":"\n"},{"type":"element","tag":"prose-li","props":{},"children":[{"type":"text","value":"\n"},{"type":"element","tag":"prose-code-inline","props":{},"children":[{"type":"text","value":"generate:routeCreated"}]},{"type":"text","value":" (Route générée)"},{"type":"text","value":"\n"}]},{"type":"text","value":"\n"}]},{"type":"text","value":"\n"}]},{"type":"text","value":"\n"},{"type":"element","tag":"prose-li","props":{},"children":[{"type":"text","value":"\n"},{"type":"element","tag":"prose-code-inline","props":{},"children":[{"type":"text","value":"generate:done"}]},{"type":"text","value":" quand tous les fichiers HTML ont été générés"},{"type":"text","value":"\n"}]},{"type":"text","value":"\n"}]},{"type":"text","value":"\n"},{"type":"element","tag":"prose-h3","props":{"id":"client"},"children":[{"type":"element","tag":"prose-a","props":{"href":"#client"},"children":[{"type":"text","value":"Client"}]}]},{"type":"text","value":"\n"},{"type":"element","tag":"prose-paragraph","props":{},"children":[{"type":"text","value":"Cette partie du cycle est entièrement exécutée dans le navigateur, peu importe le mode que nous avons choisi pour Nuxt."}]},{"type":"text","value":"\n"},{"type":"element","tag":"prose-ul","props":{},"children":[{"type":"text","value":"\n"},{"type":"element","tag":"prose-li","props":{},"children":[{"type":"text","value":"\n"},{"type":"text","value":"Reçoit le HTML"},{"type":"text","value":"\n"}]},{"type":"text","value":"\n"},{"type":"element","tag":"prose-li","props":{},"children":[{"type":"text","value":"\n"},{"type":"text","value":"Charge les ressources (ex. Javascript)"},{"type":"text","value":"\n"}]},{"type":"text","value":"\n"},{"type":"element","tag":"prose-li","props":{},"children":[{"type":"text","value":"\n"},{"type":"text","value":"Hydratation de Vue"},{"type":"text","value":"\n"}]},{"type":"text","value":"\n"},{"type":"element","tag":"prose-li","props":{},"children":[{"type":"text","value":"\n"},{"type":"text","value":"Middleware"},{"type":"text","value":"\n"},{"type":"element","tag":"prose-ul","props":{},"children":[{"type":"text","value":"\n"},{"type":"element","tag":"prose-li","props":{},"children":[{"type":"text","value":"\n"},{"type":"text","value":"Global middleware"},{"type":"text","value":"\n"}]},{"type":"text","value":"\n"},{"type":"element","tag":"prose-li","props":{},"children":[{"type":"text","value":"\n"},{"type":"text","value":"Layout middleware"},{"type":"text","value":"\n"}]},{"type":"text","value":"\n"},{"type":"element","tag":"prose-li","props":{},"children":[{"type":"text","value":"\n"},{"type":"text","value":"Route middleware"},{"type":"text","value":"\n"}]},{"type":"text","value":"\n"}]},{"type":"text","value":"\n"}]},{"type":"text","value":"\n"},{"type":"element","tag":"prose-li","props":{},"children":[{"type":"text","value":"\n"},{"type":"text","value":"asyncData (bloquant)"},{"type":"text","value":"\n"}]},{"type":"text","value":"\n"},{"type":"element","tag":"prose-li","props":{},"children":[{"type":"text","value":"\n"},{"type":"text","value":"plugins clients de Nuxt"},{"type":"text","value":"\n"},{"type":"element","tag":"prose-ul","props":{},"children":[{"type":"text","value":"\n"},{"type":"element","tag":"prose-li","props":{},"children":[{"type":"text","value":"\n"},{"type":"text","value":"en suivant l'ordre défini dans nuxt.config.js"},{"type":"text","value":"\n"}]},{"type":"text","value":"\n"}]},{"type":"text","value":"\n"}]},{"type":"text","value":"\n"},{"type":"element","tag":"prose-li","props":{},"children":[{"type":"text","value":"\n"},{"type":"text","value":"beforeCreate (méthode du cycle de vie de Vue)"},{"type":"text","value":"\n"}]},{"type":"text","value":"\n"},{"type":"element","tag":"prose-li","props":{},"children":[{"type":"text","value":"\n"},{"type":"text","value":"created (méthode du cycle de vie de Vue)"},{"type":"text","value":"\n"}]},{"type":"text","value":"\n"},{"type":"element","tag":"prose-li","props":{},"children":[{"type":"text","value":"\n"},{"type":"text","value":"Le nouveau fetch (du haut vers le bas, en parallèle si ce sont des voisins)"},{"type":"text","value":"\n"}]},{"type":"text","value":"\n"},{"type":"element","tag":"prose-li","props":{},"children":[{"type":"text","value":"\n"},{"type":"text","value":"beforeMount (méthode du cycle de vie de Vue)"},{"type":"text","value":"\n"}]},{"type":"text","value":"\n"},{"type":"element","tag":"prose-li","props":{},"children":[{"type":"text","value":"\n"},{"type":"text","value":"mounted (méthode du cycle de vie de Vue)"},{"type":"text","value":"\n"}]},{"type":"text","value":"\n"}]},{"type":"text","value":"\n"},{"type":"element","tag":"prose-h3","props":{"id":"naviguer-en-utilisant-le-composant-nuxtlink"},"children":[{"type":"element","tag":"prose-a","props":{"href":"#naviguer-en-utilisant-le-composant-nuxtlink"},"children":[{"type":"text","value":"Naviguer en utilisant le composant NuxtLink"}]}]},{"type":"text","value":"\n"},{"type":"element","tag":"prose-paragraph","props":{},"children":[{"type":"text","value":"De la même façon que pour la partie "},{"type":"element","tag":"prose-em","props":{},"children":[{"type":"text","value":"client"}]},{"type":"text","value":", tout se passe dans le navigateur mais seulement lors d'une navigation avec "},{"type":"element","tag":"prose-code-inline","props":{},"children":[{"type":"text","value":"<NuxtLink>"}]},{"type":"text","value":". De plus, aucun contenu n'est affiché sur la page tant qu'il reste des tâches "},{"type":"element","tag":"prose-em","props":{},"children":[{"type":"text","value":"bloquantes"}]},{"type":"text","value":"."}]},{"type":"text","value":"\n"},{"type":"element","tag":"alert","props":{"type":"info"},"children":[{"type":"element","tag":"prose-paragraph","props":{},"children":[{"type":"text","value":"Se référer au chapitre sur les composants pour plus d'informations sur "},{"type":"element","tag":"prose-a","props":{"href":"/docs/features/nuxt-components#the-nuxtlink-component"},"children":[{"type":"element","tag":"prose-code-inline","props":{},"children":[{"type":"text","value":"<NuxtLink>"}]}]},{"type":"text","value":"."}]}]},{"type":"text","value":"\n"},{"type":"element","tag":"prose-ul","props":{},"children":[{"type":"text","value":"\n"},{"type":"element","tag":"prose-li","props":{},"children":[{"type":"text","value":"\n"},{"type":"text","value":"middleware (bloquant)"},{"type":"text","value":"\n"},{"type":"element","tag":"prose-ul","props":{},"children":[{"type":"text","value":"\n"},{"type":"element","tag":"prose-li","props":{},"children":[{"type":"text","value":"\n"},{"type":"text","value":"Global middleware"},{"type":"text","value":"\n"}]},{"type":"text","value":"\n"},{"type":"element","tag":"prose-li","props":{},"children":[{"type":"text","value":"\n"},{"type":"text","value":"Layout middleware"},{"type":"text","value":"\n"}]},{"type":"text","value":"\n"},{"type":"element","tag":"prose-li","props":{},"children":[{"type":"text","value":"\n"},{"type":"text","value":"Route middleware"},{"type":"text","value":"\n"}]},{"type":"text","value":"\n"}]},{"type":"text","value":"\n"}]},{"type":"text","value":"\n"},{"type":"element","tag":"prose-li","props":{},"children":[{"type":"text","value":"\n"},{"type":"text","value":"asyncData (bloquant)"},{"type":"text","value":"\n"}]},{"type":"text","value":"\n"},{"type":"element","tag":"prose-li","props":{},"children":[{"type":"text","value":"\n"},{"type":"text","value":"asyncData (bloquant) "},{"type":"element","tag":"span","props":{},"children":[{"type":"text","value":"ou chargement entièrement statique du payload"}]},{"type":"text","value":"\n"}]},{"type":"text","value":"\n"},{"type":"element","tag":"prose-li","props":{},"children":[{"type":"text","value":"\n"},{"type":"text","value":"beforeCreate & created (méthode du cycle de vie de Vue)"},{"type":"text","value":"\n"}]},{"type":"text","value":"\n"},{"type":"element","tag":"prose-li","props":{},"children":[{"type":"text","value":"\n"},{"type":"text","value":"fetch (non-bloquant)"},{"type":"text","value":"\n"}]},{"type":"text","value":"\n"},{"type":"element","tag":"prose-li","props":{},"children":[{"type":"text","value":"\n"},{"type":"text","value":"beforeMount & mounted"},{"type":"text","value":"\n"}]},{"type":"text","value":"\n"}]},{"type":"text","value":"\n"},{"type":"element","tag":"prose-h3","props":{"id":"ensuite-"},"children":[{"type":"element","tag":"prose-a","props":{"href":"#ensuite-"},"children":[{"type":"text","value":"Ensuite ?"}]}]},{"type":"text","value":"\n"},{"type":"element","tag":"alert","props":{"type":"next"},"children":[{"type":"element","tag":"prose-paragraph","props":{},"children":[{"type":"text","value":"Plus d'informations dans le "},{"type":"element","tag":"prose-a","props":{"href":"/docs/features/rendering-modes"},"children":[{"type":"text","value":"recueil sur les features"}]},{"type":"text","value":"."}]}]}]},"toc":{"title":"","searchDepth":2,"depth":2,"links":[{"id":"cycle-de-vie","depth":2,"text":"Cycle de vie","children":[{"id":"serveur","depth":3,"text":"Serveur"},{"id":"client","depth":3,"text":"Client"},{"id":"naviguer-en-utilisant-le-composant-nuxtlink","depth":3,"text":"Naviguer en utilisant le composant NuxtLink"},{"id":"ensuite-","depth":3,"text":"Ensuite ?"}]}]}}}