{"key":"content:fr:docs:5.configuration-glossary:5.configuration-css.md","generatedAt":"2022-03-15T12:18:25.075Z","mtime":"2022-03-15T12:18:25.069Z","slug":"configuration-css","title":"La propriété css","position":"999900050005","to":"/docs/configuration-glossary/configuration-css","draft":false,"page":true,"language":"fr","navigation":{"title":"css"},"description":"Nuxt permet aux fichiers/modules/librairies que l'on veut d'être définis de manière globale (inclus dans chaque page).","menu":"css","category":"configuration-glossary","empty":false,"body":{"raw":"---\ntitle: La propriété css\nnavigation.title: css\ndescription: Nuxt permet aux fichiers/modules/librairies que l'on veut d'être définis de manière globale (inclus dans chaque page).\nmenu: css\ncategory: configuration-glossary\n---\n# La propriété css\n\nNuxt permet aux fichiers/modules/librairies que l'on veut d'être définis de manière globale (inclus dans chaque page).\n\n---\n\nSi on veut utiliser `SASS`, il faut bien faire attention à avoir les packages `sass` et `sass-loader` d'installés. Si ce n'est pas encore le cas, on peut faire:\n\n::code-group\n```sh [Yarn]\nyarn add --dev sass sass-loader@10\n```\n```sh [NPM]\nnpm install --save-dev sass sass-loader@10\n```\n::\n\n- Type: `Array`\n  - Items: `string`\n\n```js{}[nuxt.config.js]\nexport default {\n  css: [\n    // charge un module Node.js directement (ici c'est un fichier SASS)\n    'bulma',\n    // fichier CSS dans le projet\n    '@/assets/css/main.css',\n    // fichier SCSS dans le projet\n    '@/assets/css/main.scss'\n  ]\n}\n```\n\nNuxt va automatiquement deviner le type de fichier par son extension et utiliser le loader du pré-processeur adéquat pour Webpack. Nous aurons cependant besoin d'installer le loader requis si nous avons besoin de l'utiliser.\n\n### Extensions de style\n\nOn peut omettre l'extension de nos fichiers CSS/SCSS/Postcss/Less/Stylus/... listés dans le tableau `css` du fichier `nuxt.config.js`.\n\n```js{}[nuxt.config.js]\nexport default {\n  css: ['~/assets/css/main', '~/assets/css/animations']\n}\n```\n\n::alert{type=\"warning\"}\nSi nous avons deux fichiers du même nom, par ex `main.scss` et `main.css` et si on ne spécifie par l'extension dans le tableau `css` par ex `css: ['~/assets/css/main']` alors seulement un fichier sera chargé en fonction de l'ordre défini par `styleExtensions`. Dans ce cas, le fichier `css` sera chargé et le `scss` sera ignoré parce que l'extension `css` arrive en premier dans le tableau `styleExtension`.\n::\n\nOrdre par défaut: `['css', 'pcss', 'postcss', 'styl', 'stylus', 'scss', 'sass', 'less']`\n","ast":{"type":"root","children":[{"type":"element","tag":"prose-h1","props":{"class":"d-heading-title","id":"la-propriété-css"},"children":[{"type":"text","value":"La propriété css"}]},{"type":"text","value":"\n"},{"type":"element","tag":"prose-paragraph","props":{"class":"d-heading-description"},"children":[{"type":"text","value":"Nuxt permet aux fichiers/modules/librairies que l'on veut d'être définis de manière globale (inclus dans chaque page)."}]},{"type":"text","value":"\n"},{"type":"element","tag":"prose-hr","props":{"class":"d-heading-hr"},"children":[]},{"type":"text","value":"\n"},{"type":"element","tag":"prose-paragraph","props":{},"children":[{"type":"text","value":"Si on veut utiliser "},{"type":"element","tag":"prose-code-inline","props":{},"children":[{"type":"text","value":"SASS"}]},{"type":"text","value":", il faut bien faire attention à avoir les packages "},{"type":"element","tag":"prose-code-inline","props":{},"children":[{"type":"text","value":"sass"}]},{"type":"text","value":" et "},{"type":"element","tag":"prose-code-inline","props":{},"children":[{"type":"text","value":"sass-loader"}]},{"type":"text","value":" d'installés. Si ce n'est pas encore le cas, on peut faire:"}]},{"type":"text","value":"\n"},{"type":"element","tag":"code-group","props":{},"children":[{"type":"element","tag":"prose-code","props":{},"children":[{"type":"element","tag":"span","props":{"className":["filename"]},"children":[{"type":"text","value":"Yarn"}]},{"type":"element","tag":"pre","props":{"className":["line-numbers","language-text"]},"children":[{"type":"element","tag":"code","props":{},"children":[{"type":"text","value":"yarn add --dev sass sass-loader@10\n"}]}]}]},{"type":"element","tag":"prose-code","props":{},"children":[{"type":"element","tag":"span","props":{"className":["filename"]},"children":[{"type":"text","value":"NPM"}]},{"type":"element","tag":"pre","props":{"className":["line-numbers","language-text"]},"children":[{"type":"element","tag":"code","props":{},"children":[{"type":"text","value":"npm install --save-dev sass sass-loader@10\n"}]}]}]}]},{"type":"text","value":"\n"},{"type":"element","tag":"prose-ul","props":{},"children":[{"type":"text","value":"\n"},{"type":"element","tag":"prose-li","props":{},"children":[{"type":"text","value":"\n"},{"type":"text","value":"Type: "},{"type":"element","tag":"prose-code-inline","props":{},"children":[{"type":"text","value":"Array"}]},{"type":"text","value":"\n"},{"type":"element","tag":"prose-ul","props":{},"children":[{"type":"text","value":"\n"},{"type":"element","tag":"prose-li","props":{},"children":[{"type":"text","value":"\n"},{"type":"text","value":"Items: "},{"type":"element","tag":"prose-code-inline","props":{},"children":[{"type":"text","value":"string"}]},{"type":"text","value":"\n"}]},{"type":"text","value":"\n"}]},{"type":"text","value":"\n"}]},{"type":"text","value":"\n"}]},{"type":"text","value":"\n"},{"type":"element","tag":"prose-code","props":{},"children":[{"type":"element","tag":"span","props":{"className":["filename"]},"children":[{"type":"text","value":"nuxt.config.js"}]},{"type":"element","tag":"pre","props":{"className":["line-numbers","language-js"]},"children":[{"type":"element","tag":"code","props":{},"children":[{"type":"element","tag":"span","props":{"className":["token","keyword","module"]},"children":[{"type":"text","value":"export"}]},{"type":"text","value":" "},{"type":"element","tag":"span","props":{"className":["token","keyword","module"]},"children":[{"type":"text","value":"default"}]},{"type":"text","value":" "},{"type":"element","tag":"span","props":{"className":["token","punctuation"]},"children":[{"type":"text","value":"{"}]},{"type":"text","value":"\n  css"},{"type":"element","tag":"span","props":{"className":["token","operator"]},"children":[{"type":"text","value":":"}]},{"type":"text","value":" "},{"type":"element","tag":"span","props":{"className":["token","punctuation"]},"children":[{"type":"text","value":"["}]},{"type":"text","value":"\n    "},{"type":"element","tag":"span","props":{"className":["token","comment"]},"children":[{"type":"text","value":"// charge un module Node.js directement (ici c'est un fichier SASS)"}]},{"type":"text","value":"\n    "},{"type":"element","tag":"span","props":{"className":["token","string"]},"children":[{"type":"text","value":"'bulma'"}]},{"type":"element","tag":"span","props":{"className":["token","punctuation"]},"children":[{"type":"text","value":","}]},{"type":"text","value":"\n    "},{"type":"element","tag":"span","props":{"className":["token","comment"]},"children":[{"type":"text","value":"// fichier CSS dans le projet"}]},{"type":"text","value":"\n    "},{"type":"element","tag":"span","props":{"className":["token","string"]},"children":[{"type":"text","value":"'@/assets/css/main.css'"}]},{"type":"element","tag":"span","props":{"className":["token","punctuation"]},"children":[{"type":"text","value":","}]},{"type":"text","value":"\n    "},{"type":"element","tag":"span","props":{"className":["token","comment"]},"children":[{"type":"text","value":"// fichier SCSS dans le projet"}]},{"type":"text","value":"\n    "},{"type":"element","tag":"span","props":{"className":["token","string"]},"children":[{"type":"text","value":"'@/assets/css/main.scss'"}]},{"type":"text","value":"\n  "},{"type":"element","tag":"span","props":{"className":["token","punctuation"]},"children":[{"type":"text","value":"]"}]},{"type":"text","value":"\n"},{"type":"element","tag":"span","props":{"className":["token","punctuation"]},"children":[{"type":"text","value":"}"}]},{"type":"text","value":"\n"}]}]}]},{"type":"text","value":"\n"},{"type":"element","tag":"prose-paragraph","props":{},"children":[{"type":"text","value":"Nuxt va automatiquement deviner le type de fichier par son extension et utiliser le loader du pré-processeur adéquat pour Webpack. Nous aurons cependant besoin d'installer le loader requis si nous avons besoin de l'utiliser."}]},{"type":"text","value":"\n"},{"type":"element","tag":"prose-h3","props":{"id":"extensions-de-style"},"children":[{"type":"element","tag":"prose-a","props":{"href":"#extensions-de-style"},"children":[{"type":"text","value":"Extensions de style"}]}]},{"type":"text","value":"\n"},{"type":"element","tag":"prose-paragraph","props":{},"children":[{"type":"text","value":"On peut omettre l'extension de nos fichiers CSS/SCSS/Postcss/Less/Stylus/... listés dans le tableau "},{"type":"element","tag":"prose-code-inline","props":{},"children":[{"type":"text","value":"css"}]},{"type":"text","value":" du fichier "},{"type":"element","tag":"prose-code-inline","props":{},"children":[{"type":"text","value":"nuxt.config.js"}]},{"type":"text","value":"."}]},{"type":"text","value":"\n"},{"type":"element","tag":"prose-code","props":{},"children":[{"type":"element","tag":"span","props":{"className":["filename"]},"children":[{"type":"text","value":"nuxt.config.js"}]},{"type":"element","tag":"pre","props":{"className":["line-numbers","language-js"]},"children":[{"type":"element","tag":"code","props":{},"children":[{"type":"element","tag":"span","props":{"className":["token","keyword","module"]},"children":[{"type":"text","value":"export"}]},{"type":"text","value":" "},{"type":"element","tag":"span","props":{"className":["token","keyword","module"]},"children":[{"type":"text","value":"default"}]},{"type":"text","value":" "},{"type":"element","tag":"span","props":{"className":["token","punctuation"]},"children":[{"type":"text","value":"{"}]},{"type":"text","value":"\n  css"},{"type":"element","tag":"span","props":{"className":["token","operator"]},"children":[{"type":"text","value":":"}]},{"type":"text","value":" "},{"type":"element","tag":"span","props":{"className":["token","punctuation"]},"children":[{"type":"text","value":"["}]},{"type":"element","tag":"span","props":{"className":["token","string"]},"children":[{"type":"text","value":"'~/assets/css/main'"}]},{"type":"element","tag":"span","props":{"className":["token","punctuation"]},"children":[{"type":"text","value":","}]},{"type":"text","value":" "},{"type":"element","tag":"span","props":{"className":["token","string"]},"children":[{"type":"text","value":"'~/assets/css/animations'"}]},{"type":"element","tag":"span","props":{"className":["token","punctuation"]},"children":[{"type":"text","value":"]"}]},{"type":"text","value":"\n"},{"type":"element","tag":"span","props":{"className":["token","punctuation"]},"children":[{"type":"text","value":"}"}]},{"type":"text","value":"\n"}]}]}]},{"type":"text","value":"\n"},{"type":"element","tag":"alert","props":{"type":"warning"},"children":[{"type":"element","tag":"prose-paragraph","props":{},"children":[{"type":"text","value":"Si nous avons deux fichiers du même nom, par ex "},{"type":"element","tag":"prose-code-inline","props":{},"children":[{"type":"text","value":"main.scss"}]},{"type":"text","value":" et "},{"type":"element","tag":"prose-code-inline","props":{},"children":[{"type":"text","value":"main.css"}]},{"type":"text","value":" et si on ne spécifie par l'extension dans le tableau "},{"type":"element","tag":"prose-code-inline","props":{},"children":[{"type":"text","value":"css"}]},{"type":"text","value":" par ex "},{"type":"element","tag":"prose-code-inline","props":{},"children":[{"type":"text","value":"css: ['~/assets/css/main']"}]},{"type":"text","value":" alors seulement un fichier sera chargé en fonction de l'ordre défini par "},{"type":"element","tag":"prose-code-inline","props":{},"children":[{"type":"text","value":"styleExtensions"}]},{"type":"text","value":". Dans ce cas, le fichier "},{"type":"element","tag":"prose-code-inline","props":{},"children":[{"type":"text","value":"css"}]},{"type":"text","value":" sera chargé et le "},{"type":"element","tag":"prose-code-inline","props":{},"children":[{"type":"text","value":"scss"}]},{"type":"text","value":" sera ignoré parce que l'extension "},{"type":"element","tag":"prose-code-inline","props":{},"children":[{"type":"text","value":"css"}]},{"type":"text","value":" arrive en premier dans le tableau "},{"type":"element","tag":"prose-code-inline","props":{},"children":[{"type":"text","value":"styleExtension"}]},{"type":"text","value":"."}]}]},{"type":"text","value":"\n"},{"type":"element","tag":"prose-paragraph","props":{},"children":[{"type":"text","value":"Ordre par défaut: "},{"type":"element","tag":"prose-code-inline","props":{},"children":[{"type":"text","value":"['css', 'pcss', 'postcss', 'styl', 'stylus', 'scss', 'sass', 'less']"}]}]}]},"toc":{"title":"","searchDepth":2,"depth":2,"links":[{"id":"extensions-de-style","depth":3,"text":"Extensions de style"}]}}}