{"key":"content:pt:deployments:koyeb.md","generatedAt":"2022-03-15T12:18:30.856Z","mtime":"2022-03-15T12:18:30.844Z","slug":"koyeb","title":"Koyeb","position":"999999999999","to":"/pt/deployments/koyeb","draft":false,"page":true,"language":"en","template":"guide","description":"Desdobrar o Nuxt na Plataforma Serverless da Koyeb com Docker","target":"Server","category":"deployment","logo":{"light":"/img/companies/square/light/Koyeb.svg","dark":"/img/companies/square/dark/Koyeb.svg"},"empty":false,"body":{"raw":"---\ntemplate: guide\ntitle: Koyeb\ndescription: Desdobrar o Nuxt na Plataforma Serverless da Koyeb com Docker\ntarget: Server\ncategory: deployment\nlogo:\n  light: \"/img/companies/square/light/Koyeb.svg\"\n  dark: \"/img/companies/square/dark/Koyeb.svg\"\n---\n# Desdobrar o Nuxt na Plataforma Serverless da Koyeb\n\nDesdobrar o Nuxt na Plataforma Serverless da Koyeb com Docker\n\n---\n\nA [Koyeb](https://www.koyeb.com) é uma plataforma serverless amigável ao desenvolvedor para desdobrar aplicações globalmente. A plataforma permite você ininterruptamente executar contentores do Docker, aplicações web, APIs com desdobramento baseado no Git, escalamento nativo automático, uma rede de limite global, e serviço de coordenação e descoberta embutido.\n\nNeste guia, nós mostraremos como dockerizar e desdobrar uma aplicação Nuxt na plataforma Koyeb.\n\n> A Koyeb permite você desdobrar contentores do Docker a partir do registo de sua escolha. Neste guia nós usamos o Docker Hub para guardar nossa imagem mas você está livre de usar o [Registo de Contentor do GitHub](https://docs.github.com/en/packages/working-with-a-github-packages-registry/working-with-the-container-registry), o [Registo de Contentor do GitLab](https://docs.gitlab.com/ee/user/packages/container_registry/) ou qualquer outro provedor de registo de contentor.\n\n## Requisitos\n\nPara seguir com êxito e completar este guia, você precisa:\n\n1. Um projeto Nuxt para desdobrar. Você pode usar o [create-nuxt-app](https://github.com/nuxt/create-nuxt-app) para criar um projeto Nuxt e começar.\n2. Uma [conta no Koyeb](https://app.koyeb.com) para desdobrar e executar a aplicação Nuxt dockerizada\n3. Uma conta no [Docker Hub](https://hub.docker.com/) para empurrar a imagem do Docker e desdobrar ela no Koyeb\n\n## Começar\n\nDentro do diretório da sua aplicação Nuxt execute o seguinte comando para instalar as dependências:\n\n```bash\nyarn\n```\n\nUma vez que as dependências estão instaladas, execute a sua aplicação e certifique que tudo está funcionando corretamente:\n\n```bash\nyarn dev\n```\n\n## Dockerizar a sua aplicação\n\nPara Dockerizar a sua aplicação Nuxt, você precisa criar um ficheiro `Dockerfile` dentro do diretório do seu projeto contendo o conteúdo abaixo:\n\n```dockerfile\nFROM node:lts as builder\n\nWORKDIR /app\n\nCOPY . .\n\nRUN yarn install \\\n  --prefer-offline \\\n  --frozen-lockfile \\\n  --non-interactive \\\n  --production=false\n\nRUN yarn build\n\nRUN rm -rf node_modules && \\\n  NODE_ENV=production yarn install \\\n  --prefer-offline \\\n  --pure-lockfile \\\n  --non-interactive \\\n  --production=true\n\nFROM node:lts\n\nWORKDIR /app\n\nCOPY --from=builder /app  .\n\nENV HOST 0.0.0.0\nEXPOSE 80\n\nCMD [ \"yarn\", \"start\" ]\n```\n\nPara construir uma imagem do Docker execute o seguinte comando:\n\n```bash\ndocker build . -t <YOUR_DOCKER_HUB_USERNAME>/my-nuxt-project\n```\n\nEste comando construirá a imagem do Docker com o nome <YOUR_DOCKER_HUB>/my-nuxt-project. Um vez que a construção estiver terminada, você pode executar um contentor usando a imagem localmente para validar que tudo está funcionado como o esperado.\n\n```bash\ndocker run -p 3000:3000 <YOUR_DOCKER_HUB_USERNAME>/my-nuxt-project\n```\n\nAbra o seu navegador e navegue até o http://localhost:3000 para visualizar a página de desembarque da sua aplicação.\n\n## Empurrar a sua imagem do Docker para o registo de contentor\n\nDepois de nossa imagem do Docker estar construida e funcional dentro do nosso teste, nós podemos agora carregar ela para um registo de contentor. Nesta documentação, nós guardaremos a nossa imagem no Docker Hub. Dentro do seu terminal execute o comando abaixo para empurrar a imagem:\n\n```bash\ndocker push <YOUR_DOCKER_HUB_USERNAME>/my-nuxt-project\n```\n\n## Desdobrar a aplicação Nuxt para produção na Koyeb\n\nNo Painel de Controlo da Koyeb, clique no botão **Create App (Criar Aplicação)**.\n\nDentro do formulário, preencha o campo `Docker image (imagem do Docker)` com o nome da imagem de nós criamos previamente a qual deve parecer com `<YOUR_DOCKER_HUB_USERNAME>/my-nuxt-project`.\n\nMarque a caixa `Use a private registry (Usar um registo privado)` e, dentro do campo selecionar, clique em **Create Repository Secret (Criar Segredo de Repositório)**. \n\nUm modal abre pedindo por:\n\n- um nome para o Segredo que será criado, nós podemos usar para instância `docker-hub-secret`\n- o provedor de registo para gerar o segredo contendo as credenciais do seu registo privado, no nosso caso o Docker Hub\n- o seu nome de usuário do Docker Hub e a palavra-chave. Nós recomendamos a você [criar um código (token) de acesso](https://hub.docker.com/settings/security) a partir do Docker Hub para usar no lugar da sua palavra-chave. Uma vez que você tem preenchido todos os campos, clique no botão **Create (Criar)**.\n\nNós não precisamos mudar o _Path (Caminho)_, a nossa aplicação estará disponível na raiz do nosso domínio: `/`.\n\nDê um nome a sua Aplicação, exemplo `nuxt-app`, e clique em **Create App (Criar Aplicação)**.\n\n_Você pode adicionar mais regiões para desdobrar suas aplicações, definir variáveis de ambiente, e definir escalamento horizontal de acordo com as suas necessidades._\n\nVocê será automaticamente redirecionado para a página Koyeb App onde você pode seguir o progresso do desdobramento da sua aplicação Nuxt. Dentro de poucos segundos, um vez que a sua aplicação está desdobrada, clique na _Public URL (URL Pública)_ que termina com `koyeb.app`.\n\nA sua aplicação Nuxt agora está executando na Koyeb e beneficia do escalamento nativo automático, HTTPs (SSL) automático, auto-estabilização, e balanceador de carregamento global através do limite da nossa rede.\n","ast":{"type":"root","children":[{"type":"element","tag":"prose-h1","props":{"class":"d-heading-title","id":"desdobrar-o-nuxt-na-plataforma-serverless-da-koyeb"},"children":[{"type":"text","value":"Desdobrar o Nuxt na Plataforma Serverless da Koyeb"}]},{"type":"text","value":"\n"},{"type":"element","tag":"prose-paragraph","props":{"class":"d-heading-description"},"children":[{"type":"text","value":"Desdobrar o Nuxt na Plataforma Serverless da Koyeb com Docker"}]},{"type":"text","value":"\n"},{"type":"element","tag":"prose-hr","props":{"class":"d-heading-hr"},"children":[]},{"type":"text","value":"\n"},{"type":"element","tag":"prose-paragraph","props":{},"children":[{"type":"text","value":"A "},{"type":"element","tag":"prose-a","props":{"href":"https://www.koyeb.com","rel":["nofollow","noopener","noreferrer"],"target":"_blank"},"children":[{"type":"text","value":"Koyeb"}]},{"type":"text","value":" é uma plataforma serverless amigável ao desenvolvedor para desdobrar aplicações globalmente. A plataforma permite você ininterruptamente executar contentores do Docker, aplicações web, APIs com desdobramento baseado no Git, escalamento nativo automático, uma rede de limite global, e serviço de coordenação e descoberta embutido."}]},{"type":"text","value":"\n"},{"type":"element","tag":"prose-paragraph","props":{},"children":[{"type":"text","value":"Neste guia, nós mostraremos como dockerizar e desdobrar uma aplicação Nuxt na plataforma Koyeb."}]},{"type":"text","value":"\n"},{"type":"element","tag":"prose-blockquote","props":{},"children":[{"type":"text","value":"\n"},{"type":"element","tag":"prose-paragraph","props":{},"children":[{"type":"text","value":"A Koyeb permite você desdobrar contentores do Docker a partir do registo de sua escolha. Neste guia nós usamos o Docker Hub para guardar nossa imagem mas você está livre de usar o "},{"type":"element","tag":"prose-a","props":{"href":"https://docs.github.com/en/packages/working-with-a-github-packages-registry/working-with-the-container-registry","rel":["nofollow","noopener","noreferrer"],"target":"_blank"},"children":[{"type":"text","value":"Registo de Contentor do GitHub"}]},{"type":"text","value":", o "},{"type":"element","tag":"prose-a","props":{"href":"https://docs.gitlab.com/ee/user/packages/container_registry/","rel":["nofollow","noopener","noreferrer"],"target":"_blank"},"children":[{"type":"text","value":"Registo de Contentor do GitLab"}]},{"type":"text","value":" ou qualquer outro provedor de registo de contentor."}]},{"type":"text","value":"\n"}]},{"type":"text","value":"\n"},{"type":"element","tag":"prose-h2","props":{"id":"requisitos"},"children":[{"type":"element","tag":"prose-a","props":{"href":"#requisitos"},"children":[{"type":"text","value":"Requisitos"}]}]},{"type":"text","value":"\n"},{"type":"element","tag":"prose-paragraph","props":{},"children":[{"type":"text","value":"Para seguir com êxito e completar este guia, você precisa:"}]},{"type":"text","value":"\n"},{"type":"element","tag":"prose-ol","props":{},"children":[{"type":"text","value":"\n"},{"type":"element","tag":"prose-li","props":{},"children":[{"type":"text","value":"\n"},{"type":"text","value":"Um projeto Nuxt para desdobrar. Você pode usar o "},{"type":"element","tag":"prose-a","props":{"href":"https://github.com/nuxt/create-nuxt-app","rel":["nofollow","noopener","noreferrer"],"target":"_blank"},"children":[{"type":"text","value":"create-nuxt-app"}]},{"type":"text","value":" para criar um projeto Nuxt e começar."},{"type":"text","value":"\n"}]},{"type":"text","value":"\n"},{"type":"element","tag":"prose-li","props":{},"children":[{"type":"text","value":"\n"},{"type":"text","value":"Uma "},{"type":"element","tag":"prose-a","props":{"href":"https://app.koyeb.com","rel":["nofollow","noopener","noreferrer"],"target":"_blank"},"children":[{"type":"text","value":"conta no Koyeb"}]},{"type":"text","value":" para desdobrar e executar a aplicação Nuxt dockerizada"},{"type":"text","value":"\n"}]},{"type":"text","value":"\n"},{"type":"element","tag":"prose-li","props":{},"children":[{"type":"text","value":"\n"},{"type":"text","value":"Uma conta no "},{"type":"element","tag":"prose-a","props":{"href":"https://hub.docker.com/","rel":["nofollow","noopener","noreferrer"],"target":"_blank"},"children":[{"type":"text","value":"Docker Hub"}]},{"type":"text","value":" para empurrar a imagem do Docker e desdobrar ela no Koyeb"},{"type":"text","value":"\n"}]},{"type":"text","value":"\n"}]},{"type":"text","value":"\n"},{"type":"element","tag":"prose-h2","props":{"id":"começar"},"children":[{"type":"element","tag":"prose-a","props":{"href":"#come%C3%A7ar"},"children":[{"type":"text","value":"Começar"}]}]},{"type":"text","value":"\n"},{"type":"element","tag":"prose-paragraph","props":{},"children":[{"type":"text","value":"Dentro do diretório da sua aplicação Nuxt execute o seguinte comando para instalar as dependências:"}]},{"type":"text","value":"\n"},{"type":"element","tag":"prose-code","props":{},"children":[{"type":"element","tag":"pre","props":{"className":["line-numbers","language-bash"]},"children":[{"type":"element","tag":"code","props":{},"children":[{"type":"element","tag":"span","props":{"className":["token","function"]},"children":[{"type":"text","value":"yarn"}]},{"type":"text","value":"\n"}]}]}]},{"type":"text","value":"\n"},{"type":"element","tag":"prose-paragraph","props":{},"children":[{"type":"text","value":"Uma vez que as dependências estão instaladas, execute a sua aplicação e certifique que tudo está funcionando corretamente:"}]},{"type":"text","value":"\n"},{"type":"element","tag":"prose-code","props":{},"children":[{"type":"element","tag":"pre","props":{"className":["line-numbers","language-bash"]},"children":[{"type":"element","tag":"code","props":{},"children":[{"type":"element","tag":"span","props":{"className":["token","function"]},"children":[{"type":"text","value":"yarn"}]},{"type":"text","value":" dev\n"}]}]}]},{"type":"text","value":"\n"},{"type":"element","tag":"prose-h2","props":{"id":"dockerizar-a-sua-aplicação"},"children":[{"type":"element","tag":"prose-a","props":{"href":"#dockerizar-a-sua-aplica%C3%A7%C3%A3o"},"children":[{"type":"text","value":"Dockerizar a sua aplicação"}]}]},{"type":"text","value":"\n"},{"type":"element","tag":"prose-paragraph","props":{},"children":[{"type":"text","value":"Para Dockerizar a sua aplicação Nuxt, você precisa criar um ficheiro "},{"type":"element","tag":"prose-code-inline","props":{},"children":[{"type":"text","value":"Dockerfile"}]},{"type":"text","value":" dentro do diretório do seu projeto contendo o conteúdo abaixo:"}]},{"type":"text","value":"\n"},{"type":"element","tag":"prose-code","props":{},"children":[{"type":"element","tag":"pre","props":{"className":["line-numbers","language-dockerfile"]},"children":[{"type":"element","tag":"code","props":{},"children":[{"type":"element","tag":"span","props":{"className":["token","instruction"]},"children":[{"type":"element","tag":"span","props":{"className":["token","keyword"]},"children":[{"type":"text","value":"FROM"}]},{"type":"text","value":" node:lts "},{"type":"element","tag":"span","props":{"className":["token","keyword"]},"children":[{"type":"text","value":"as"}]},{"type":"text","value":" builder"}]},{"type":"text","value":"\n\n"},{"type":"element","tag":"span","props":{"className":["token","instruction"]},"children":[{"type":"element","tag":"span","props":{"className":["token","keyword"]},"children":[{"type":"text","value":"WORKDIR"}]},{"type":"text","value":" /app"}]},{"type":"text","value":"\n\n"},{"type":"element","tag":"span","props":{"className":["token","instruction"]},"children":[{"type":"element","tag":"span","props":{"className":["token","keyword"]},"children":[{"type":"text","value":"COPY"}]},{"type":"text","value":" . ."}]},{"type":"text","value":"\n\n"},{"type":"element","tag":"span","props":{"className":["token","instruction"]},"children":[{"type":"element","tag":"span","props":{"className":["token","keyword"]},"children":[{"type":"text","value":"RUN"}]},{"type":"text","value":" yarn install "},{"type":"element","tag":"span","props":{"className":["token","operator"]},"children":[{"type":"text","value":"\\"}]},{"type":"text","value":"\n  --prefer-offline "},{"type":"element","tag":"span","props":{"className":["token","operator"]},"children":[{"type":"text","value":"\\"}]},{"type":"text","value":"\n  --frozen-lockfile "},{"type":"element","tag":"span","props":{"className":["token","operator"]},"children":[{"type":"text","value":"\\"}]},{"type":"text","value":"\n  --non-interactive "},{"type":"element","tag":"span","props":{"className":["token","operator"]},"children":[{"type":"text","value":"\\"}]},{"type":"text","value":"\n  --production=false"}]},{"type":"text","value":"\n\n"},{"type":"element","tag":"span","props":{"className":["token","instruction"]},"children":[{"type":"element","tag":"span","props":{"className":["token","keyword"]},"children":[{"type":"text","value":"RUN"}]},{"type":"text","value":" yarn build"}]},{"type":"text","value":"\n\n"},{"type":"element","tag":"span","props":{"className":["token","instruction"]},"children":[{"type":"element","tag":"span","props":{"className":["token","keyword"]},"children":[{"type":"text","value":"RUN"}]},{"type":"text","value":" rm -rf node_modules && "},{"type":"element","tag":"span","props":{"className":["token","operator"]},"children":[{"type":"text","value":"\\"}]},{"type":"text","value":"\n  NODE_ENV=production yarn install "},{"type":"element","tag":"span","props":{"className":["token","operator"]},"children":[{"type":"text","value":"\\"}]},{"type":"text","value":"\n  --prefer-offline "},{"type":"element","tag":"span","props":{"className":["token","operator"]},"children":[{"type":"text","value":"\\"}]},{"type":"text","value":"\n  --pure-lockfile "},{"type":"element","tag":"span","props":{"className":["token","operator"]},"children":[{"type":"text","value":"\\"}]},{"type":"text","value":"\n  --non-interactive "},{"type":"element","tag":"span","props":{"className":["token","operator"]},"children":[{"type":"text","value":"\\"}]},{"type":"text","value":"\n  --production=true"}]},{"type":"text","value":"\n\n"},{"type":"element","tag":"span","props":{"className":["token","instruction"]},"children":[{"type":"element","tag":"span","props":{"className":["token","keyword"]},"children":[{"type":"text","value":"FROM"}]},{"type":"text","value":" node:lts"}]},{"type":"text","value":"\n\n"},{"type":"element","tag":"span","props":{"className":["token","instruction"]},"children":[{"type":"element","tag":"span","props":{"className":["token","keyword"]},"children":[{"type":"text","value":"WORKDIR"}]},{"type":"text","value":" /app"}]},{"type":"text","value":"\n\n"},{"type":"element","tag":"span","props":{"className":["token","instruction"]},"children":[{"type":"element","tag":"span","props":{"className":["token","keyword"]},"children":[{"type":"text","value":"COPY"}]},{"type":"text","value":" "},{"type":"element","tag":"span","props":{"className":["token","options"]},"children":[{"type":"element","tag":"span","props":{"className":["token","property"]},"children":[{"type":"text","value":"--from"}]},{"type":"element","tag":"span","props":{"className":["token","punctuation"]},"children":[{"type":"text","value":"="}]},{"type":"element","tag":"span","props":{"className":["token","string"]},"children":[{"type":"text","value":"builder"}]}]},{"type":"text","value":" /app  ."}]},{"type":"text","value":"\n\n"},{"type":"element","tag":"span","props":{"className":["token","instruction"]},"children":[{"type":"element","tag":"span","props":{"className":["token","keyword"]},"children":[{"type":"text","value":"ENV"}]},{"type":"text","value":" HOST 0.0.0.0"}]},{"type":"text","value":"\n"},{"type":"element","tag":"span","props":{"className":["token","instruction"]},"children":[{"type":"element","tag":"span","props":{"className":["token","keyword"]},"children":[{"type":"text","value":"EXPOSE"}]},{"type":"text","value":" 80"}]},{"type":"text","value":"\n\n"},{"type":"element","tag":"span","props":{"className":["token","instruction"]},"children":[{"type":"element","tag":"span","props":{"className":["token","keyword"]},"children":[{"type":"text","value":"CMD"}]},{"type":"text","value":" [ "},{"type":"element","tag":"span","props":{"className":["token","string"]},"children":[{"type":"text","value":"\"yarn\""}]},{"type":"text","value":", "},{"type":"element","tag":"span","props":{"className":["token","string"]},"children":[{"type":"text","value":"\"start\""}]},{"type":"text","value":" ]"}]},{"type":"text","value":"\n"}]}]}]},{"type":"text","value":"\n"},{"type":"element","tag":"prose-paragraph","props":{},"children":[{"type":"text","value":"Para construir uma imagem do Docker execute o seguinte comando:"}]},{"type":"text","value":"\n"},{"type":"element","tag":"prose-code","props":{},"children":[{"type":"element","tag":"pre","props":{"className":["line-numbers","language-bash"]},"children":[{"type":"element","tag":"code","props":{},"children":[{"type":"text","value":"docker build "},{"type":"element","tag":"span","props":{"className":["token","builtin","class-name"]},"children":[{"type":"text","value":"."}]},{"type":"text","value":" -t "},{"type":"element","tag":"span","props":{"className":["token","operator"]},"children":[{"type":"text","value":"<"}]},{"type":"text","value":"YOUR_DOCKER_HUB_USERNAME"},{"type":"element","tag":"span","props":{"className":["token","operator"]},"children":[{"type":"text","value":">"}]},{"type":"text","value":"/my-nuxt-project\n"}]}]}]},{"type":"text","value":"\n"},{"type":"element","tag":"prose-paragraph","props":{},"children":[{"type":"text","value":"Este comando construirá a imagem do Docker com o nome <YOUR_DOCKER_HUB>/my-nuxt-project. Um vez que a construção estiver terminada, você pode executar um contentor usando a imagem localmente para validar que tudo está funcionado como o esperado."}]},{"type":"text","value":"\n"},{"type":"element","tag":"prose-code","props":{},"children":[{"type":"element","tag":"pre","props":{"className":["line-numbers","language-bash"]},"children":[{"type":"element","tag":"code","props":{},"children":[{"type":"text","value":"docker run -p "},{"type":"element","tag":"span","props":{"className":["token","number"]},"children":[{"type":"text","value":"3000"}]},{"type":"text","value":":3000 "},{"type":"element","tag":"span","props":{"className":["token","operator"]},"children":[{"type":"text","value":"<"}]},{"type":"text","value":"YOUR_DOCKER_HUB_USERNAME"},{"type":"element","tag":"span","props":{"className":["token","operator"]},"children":[{"type":"text","value":">"}]},{"type":"text","value":"/my-nuxt-project\n"}]}]}]},{"type":"text","value":"\n"},{"type":"element","tag":"prose-paragraph","props":{},"children":[{"type":"text","value":"Abra o seu navegador e navegue até o "},{"type":"element","tag":"prose-a","props":{"href":"http://localhost:3000","rel":["nofollow","noopener","noreferrer"],"target":"_blank"},"children":[{"type":"text","value":"http://localhost:3000"}]},{"type":"text","value":" para visualizar a página de desembarque da sua aplicação."}]},{"type":"text","value":"\n"},{"type":"element","tag":"prose-h2","props":{"id":"empurrar-a-sua-imagem-do-docker-para-o-registo-de-contentor"},"children":[{"type":"element","tag":"prose-a","props":{"href":"#empurrar-a-sua-imagem-do-docker-para-o-registo-de-contentor"},"children":[{"type":"text","value":"Empurrar a sua imagem do Docker para o registo de contentor"}]}]},{"type":"text","value":"\n"},{"type":"element","tag":"prose-paragraph","props":{},"children":[{"type":"text","value":"Depois de nossa imagem do Docker estar construida e funcional dentro do nosso teste, nós podemos agora carregar ela para um registo de contentor. Nesta documentação, nós guardaremos a nossa imagem no Docker Hub. Dentro do seu terminal execute o comando abaixo para empurrar a imagem:"}]},{"type":"text","value":"\n"},{"type":"element","tag":"prose-code","props":{},"children":[{"type":"element","tag":"pre","props":{"className":["line-numbers","language-bash"]},"children":[{"type":"element","tag":"code","props":{},"children":[{"type":"text","value":"docker push "},{"type":"element","tag":"span","props":{"className":["token","operator"]},"children":[{"type":"text","value":"<"}]},{"type":"text","value":"YOUR_DOCKER_HUB_USERNAME"},{"type":"element","tag":"span","props":{"className":["token","operator"]},"children":[{"type":"text","value":">"}]},{"type":"text","value":"/my-nuxt-project\n"}]}]}]},{"type":"text","value":"\n"},{"type":"element","tag":"prose-h2","props":{"id":"desdobrar-a-aplicação-nuxt-para-produção-na-koyeb"},"children":[{"type":"element","tag":"prose-a","props":{"href":"#desdobrar-a-aplica%C3%A7%C3%A3o-nuxt-para-produ%C3%A7%C3%A3o-na-koyeb"},"children":[{"type":"text","value":"Desdobrar a aplicação Nuxt para produção na Koyeb"}]}]},{"type":"text","value":"\n"},{"type":"element","tag":"prose-paragraph","props":{},"children":[{"type":"text","value":"No Painel de Controlo da Koyeb, clique no botão "},{"type":"element","tag":"prose-strong","props":{},"children":[{"type":"text","value":"Create App (Criar Aplicação)"}]},{"type":"text","value":"."}]},{"type":"text","value":"\n"},{"type":"element","tag":"prose-paragraph","props":{},"children":[{"type":"text","value":"Dentro do formulário, preencha o campo "},{"type":"element","tag":"prose-code-inline","props":{},"children":[{"type":"text","value":"Docker image (imagem do Docker)"}]},{"type":"text","value":" com o nome da imagem de nós criamos previamente a qual deve parecer com "},{"type":"element","tag":"prose-code-inline","props":{},"children":[{"type":"text","value":"<YOUR_DOCKER_HUB_USERNAME>/my-nuxt-project"}]},{"type":"text","value":"."}]},{"type":"text","value":"\n"},{"type":"element","tag":"prose-paragraph","props":{},"children":[{"type":"text","value":"Marque a caixa "},{"type":"element","tag":"prose-code-inline","props":{},"children":[{"type":"text","value":"Use a private registry (Usar um registo privado)"}]},{"type":"text","value":" e, dentro do campo selecionar, clique em "},{"type":"element","tag":"prose-strong","props":{},"children":[{"type":"text","value":"Create Repository Secret (Criar Segredo de Repositório)"}]},{"type":"text","value":"."}]},{"type":"text","value":"\n"},{"type":"element","tag":"prose-paragraph","props":{},"children":[{"type":"text","value":"Um modal abre pedindo por:"}]},{"type":"text","value":"\n"},{"type":"element","tag":"prose-ul","props":{},"children":[{"type":"text","value":"\n"},{"type":"element","tag":"prose-li","props":{},"children":[{"type":"text","value":"\n"},{"type":"text","value":"um nome para o Segredo que será criado, nós podemos usar para instância "},{"type":"element","tag":"prose-code-inline","props":{},"children":[{"type":"text","value":"docker-hub-secret"}]},{"type":"text","value":"\n"}]},{"type":"text","value":"\n"},{"type":"element","tag":"prose-li","props":{},"children":[{"type":"text","value":"\n"},{"type":"text","value":"o provedor de registo para gerar o segredo contendo as credenciais do seu registo privado, no nosso caso o Docker Hub"},{"type":"text","value":"\n"}]},{"type":"text","value":"\n"},{"type":"element","tag":"prose-li","props":{},"children":[{"type":"text","value":"\n"},{"type":"text","value":"o seu nome de usuário do Docker Hub e a palavra-chave. Nós recomendamos a você "},{"type":"element","tag":"prose-a","props":{"href":"https://hub.docker.com/settings/security","rel":["nofollow","noopener","noreferrer"],"target":"_blank"},"children":[{"type":"text","value":"criar um código (token) de acesso"}]},{"type":"text","value":" a partir do Docker Hub para usar no lugar da sua palavra-chave. Uma vez que você tem preenchido todos os campos, clique no botão "},{"type":"element","tag":"prose-strong","props":{},"children":[{"type":"text","value":"Create (Criar)"}]},{"type":"text","value":"."},{"type":"text","value":"\n"}]},{"type":"text","value":"\n"}]},{"type":"text","value":"\n"},{"type":"element","tag":"prose-paragraph","props":{},"children":[{"type":"text","value":"Nós não precisamos mudar o "},{"type":"element","tag":"prose-em","props":{},"children":[{"type":"text","value":"Path (Caminho)"}]},{"type":"text","value":", a nossa aplicação estará disponível na raiz do nosso domínio: "},{"type":"element","tag":"prose-code-inline","props":{},"children":[{"type":"text","value":"/"}]},{"type":"text","value":"."}]},{"type":"text","value":"\n"},{"type":"element","tag":"prose-paragraph","props":{},"children":[{"type":"text","value":"Dê um nome a sua Aplicação, exemplo "},{"type":"element","tag":"prose-code-inline","props":{},"children":[{"type":"text","value":"nuxt-app"}]},{"type":"text","value":", e clique em "},{"type":"element","tag":"prose-strong","props":{},"children":[{"type":"text","value":"Create App (Criar Aplicação)"}]},{"type":"text","value":"."}]},{"type":"text","value":"\n"},{"type":"element","tag":"prose-paragraph","props":{},"children":[{"type":"element","tag":"prose-em","props":{},"children":[{"type":"text","value":"Você pode adicionar mais regiões para desdobrar suas aplicações, definir variáveis de ambiente, e definir escalamento horizontal de acordo com as suas necessidades."}]}]},{"type":"text","value":"\n"},{"type":"element","tag":"prose-paragraph","props":{},"children":[{"type":"text","value":"Você será automaticamente redirecionado para a página Koyeb App onde você pode seguir o progresso do desdobramento da sua aplicação Nuxt. Dentro de poucos segundos, um vez que a sua aplicação está desdobrada, clique na "},{"type":"element","tag":"prose-em","props":{},"children":[{"type":"text","value":"Public URL (URL Pública)"}]},{"type":"text","value":" que termina com "},{"type":"element","tag":"prose-code-inline","props":{},"children":[{"type":"text","value":"koyeb.app"}]},{"type":"text","value":"."}]},{"type":"text","value":"\n"},{"type":"element","tag":"prose-paragraph","props":{},"children":[{"type":"text","value":"A sua aplicação Nuxt agora está executando na Koyeb e beneficia do escalamento nativo automático, HTTPs (SSL) automático, auto-estabilização, e balanceador de carregamento global através do limite da nossa rede."}]}]},"toc":{"title":"","searchDepth":2,"depth":2,"links":[{"id":"requisitos","depth":2,"text":"Requisitos"},{"id":"começar","depth":2,"text":"Começar"},{"id":"dockerizar-a-sua-aplicação","depth":2,"text":"Dockerizar a sua aplicação"},{"id":"empurrar-a-sua-imagem-do-docker-para-o-registo-de-contentor","depth":2,"text":"Empurrar a sua imagem do Docker para o registo de contentor"},{"id":"desdobrar-a-aplicação-nuxt-para-produção-na-koyeb","depth":2,"text":"Desdobrar a aplicação Nuxt para produção na Koyeb"}]}}}