{"key":"content:pt-br:_collections:navigations:header.md","generatedAt":"2022-03-15T12:18:33.708Z","mtime":"2022-03-15T12:18:33.707Z","slug":"header","title":"Header","position":"999999999999","to":"/pt-br/collections/navigations/header","draft":false,"page":false,"language":"en","links":[{"title":"Descubra","items":[{"title":"Vitrines","subtitle":"Seleção de website construído com Nuxt","slug":"showcases","to":"/showcases","icon":"showcases.svg","color":"bg-sand"},{"title":"Estudos de caso","subtitle":"Como as companhias usam Nuxt","slug":"case-studies","to":"/case-studies","icon":"case-studies.svg","color":"bg-sand-dark"},{"title":"Depoimentos","subtitle":"O que eles pensam sobre nós","slug":"testimonials","to":"/testimonials","icon":"testimonials.svg","color":"bg-sand-darker"}]},{"title":"Aprenda","items":[{"title":"Documentação","subtitle":"Crie sites rápido facilmente","slug":"docs","to":"/docs","icon":"docs.svg","color":"bg-green-500"},{"title":"Exemplos","subtitle":"Entenda tudo no Nuxt","slug":"examples","to":"/examples","icon":"examples.svg","color":"bg-green-600"},{"title":"Tutoriais","subtitle":"Aprenda com casos práticos","slug":"tutorials","to":"/tutorials","icon":"tutorials.svg","color":"bg-green-700"},{"title":"Cursos de Mestres","subtitle":"Aprenda com os especialistas","href":"https://masteringnuxt.com/?utm_source=nuxt&utm_medium=link&utm_campaign=nsite","icon":"master-courses.svg","color":"bg-green-800"}]},{"title":"Explore","items":[{"title":"Deploy","subtitle":"Como implementar o Nuxt","slug":"deployments","to":"/deployments","icon":"deployments.svg","color":"bg-indigo-light"},{"title":"Módulos","subtitle":"Estender o poder do Nuxt","href":"https://modules.nuxtjs.org","icon":"modules.svg","color":"bg-indigo"},{"title":"Temas","subtitle":"Introdução aos temas","slug":"themes","to":"/themes","icon":"themes.svg","color":"bg-indigo-dark"},{"title":"Cursos em Vídeos","subtitle":"Aprenda passo-a-passo","slug":"video-courses","to":"/video-courses","icon":"video-courses.svg","color":"bg-indigo-darker"}]},{"title":"Comunidade","items":[{"title":"Anúncios","subtitle":"Últimas notícias sobre Nuxt","slug":"announcements","to":"/announcements","icon":"announcements.svg","color":"bg-mint-lighter"},{"title":"Equipes","subtitle":"Eles são Nuxt","slug":"teams","to":"/teams","icon":"teams.svg","color":"bg-mint-light"},{"title":"Lançamentos","subtitle":"Todo o código que lançamos","slug":"releases","to":"/releases","icon":"releases.svg","color":"bg-mint"},{"title":"Patrocinadores","subtitle":"Eles confiam em nós","slug":"sponsors","to":"/sponsors","icon":"sponsors.svg","color":"bg-mint-dark"}]},{"title":"Parceiros","slug":"partners","to":"/partners"}],"empty":true,"description":"","body":{"raw":"---\nlinks:\n  - title: 'Descubra'\n    items:\n      - title: 'Vitrines'\n        subtitle: 'Seleção de website construído com Nuxt'\n        slug: 'showcases'\n        to: '/showcases'\n        icon: 'showcases.svg'\n        color: 'bg-sand'\n      - title: 'Estudos de caso'\n        subtitle: 'Como as companhias usam Nuxt'\n        slug: 'case-studies'\n        to: '/case-studies'\n        icon: 'case-studies.svg'\n        color: 'bg-sand-dark'\n      - title: 'Depoimentos'\n        subtitle: 'O que eles pensam sobre nós'\n        slug: 'testimonials'\n        to: '/testimonials'\n        icon: 'testimonials.svg'\n        color: 'bg-sand-darker'\n  - title: 'Aprenda'\n    items:\n      - title: 'Documentação'\n        subtitle: 'Crie sites rápido facilmente'\n        slug: 'docs'\n        to: '/docs'\n        icon: 'docs.svg'\n        color: 'bg-green-500'\n      - title: 'Exemplos'\n        subtitle: 'Entenda tudo no Nuxt'\n        slug: 'examples'\n        to: '/examples'\n        icon: 'examples.svg'\n        color: 'bg-green-600'\n      - title: 'Tutoriais'\n        subtitle: 'Aprenda com casos práticos'\n        slug: 'tutorials'\n        to: '/tutorials'\n        icon: 'tutorials.svg'\n        color: 'bg-green-700'\n      - title: 'Cursos de Mestres'\n        subtitle: 'Aprenda com os especialistas'\n        href: 'https://masteringnuxt.com/?utm_source=nuxt&utm_medium=link&utm_campaign=nsite'\n        icon: 'master-courses.svg'\n        color: 'bg-green-800'\n  - title: 'Explore'\n    items:\n      - title: 'Deploy'\n        subtitle: 'Como implementar o Nuxt'\n        slug: 'deployments'\n        to: '/deployments'\n        icon: 'deployments.svg'\n        color: 'bg-indigo-light'\n      - title: 'Módulos'\n        subtitle: 'Estender o poder do Nuxt'\n        href: 'https://modules.nuxtjs.org'\n        icon: 'modules.svg'\n        color: 'bg-indigo'\n      - title: 'Temas'\n        subtitle: 'Introdução aos temas'\n        slug: 'themes'\n        to: '/themes'\n        icon: 'themes.svg'\n        color: 'bg-indigo-dark'\n      - title: 'Cursos em Vídeos'\n        subtitle: 'Aprenda passo-a-passo'\n        slug: 'video-courses'\n        to: '/video-courses'\n        icon: 'video-courses.svg'\n        color: 'bg-indigo-darker'\n  - title: 'Comunidade'\n    items:\n      - title: 'Anúncios'\n        subtitle: 'Últimas notícias sobre Nuxt'\n        slug: 'announcements'\n        to: '/announcements'\n        icon: 'announcements.svg'\n        color: 'bg-mint-lighter'\n      - title: 'Equipes'\n        subtitle: 'Eles são Nuxt'\n        slug: 'teams'\n        to: '/teams'\n        icon: 'teams.svg'\n        color: 'bg-mint-light'\n      - title: 'Lançamentos'\n        subtitle: 'Todo o código que lançamos'\n        slug: 'releases'\n        to: '/releases'\n        icon: 'releases.svg'\n        color: 'bg-mint'\n      - title: 'Patrocinadores'\n        subtitle: 'Eles confiam em nós'\n        slug: 'sponsors'\n        to: '/sponsors'\n        icon: 'sponsors.svg'\n        color: 'bg-mint-dark'\n  - title: 'Parceiros'\n    slug: 'partners'\n    to: '/partners'\n---\n","ast":{"type":"root","children":[]},"toc":{"title":"","searchDepth":2,"depth":2,"links":[]}}}