{"key":"content:pt:deployments:azure-static-web-apps.md","generatedAt":"2022-03-15T12:18:30.738Z","mtime":"2022-03-15T12:18:30.716Z","slug":"azure-static-web-apps","title":"Azure Static Web Apps","position":"999999999999","to":"/pt/deployments/azure-static-web-apps","draft":false,"page":true,"language":"en","template":"guide","description":"Como desdobrar uma aplicação Nuxt no Azure Static Web Apps?","target":"Static","category":"deployment","logo":{"light":"/img/companies/square/light/Azure.svg","dark":"/img/companies/square/dark/Azure.svg"},"empty":false,"body":{"raw":"---\ntemplate: guide\ntitle: Azure Static Web Apps\ndescription: Como desdobrar uma aplicação Nuxt no Azure Static Web Apps?\ntarget: Static\ncategory: deployment\nlogo:\n  light: \"/img/companies/square/light/Azure.svg\"\n  dark: \"/img/companies/square/dark/Azure.svg\"\n---\n# Desdobrar no Azure Static Web Apps\n\nComo desdobrar uma aplicação Nuxt no Azure Static Web Apps?\n\n---\n\nVocê podo agora desdobrar os seus sítios estáticos no Azure usando Aplicações Web Estáticas do Azure. Você precisará ter a sua aplicação dentro do GitHub visto que o Aplicações Web Estáticas do Azure influencia o GitHub Actions o qual permite você reconstruir seu sítio estático em todo `git push`.\n\nExistem duas coisas que você precisa configurar no sentido de desdobrar a sua aplicação no Aplicações Web Estáticas do Azure. A primeira é modificar o comando de construção visto que o Azure lê o comando de construção do seu package.json e para os sítios estáticos precisamos usar o comando de geração.\n\n`package.json`\n\n```json\nbuild: \"nuxt generate\"\n```\n\nA segunda é adicionar um ficheiro routes.json o qual é importante para captura de páginas 404 personalizadas e páginas de retornos das aplicações de páginas única.\n\n`static/routes.json`\n\n```jsx\n{\n \"routes\": [],\n \"platformErrorOverrides\": [\n   {\n    \"errorType\": \"NotFound\",\n    \"serve\": \"/200.html\",\n    \"statusCode\": 200\n   }\n ]\n}\n```\n\nSe você quiser testar desdobrando para as Aplicações Web Estáticas do Azure, nós temos criado uma pequena aplicação de demonstração que está toda organizada e configurada. Você apenas precisará clonar ela e adicionar ela ao seu repositório do GitHub. Você pode depois seguir os passos adiante - Desdobrando a sua aplicação com as Aplicações Web Estáticas do Azure.\n\n[Clonar a aplicação de demonstração](https://github.com/debs-obrien/nuxtjs-azure-static-app)\n\n## Desdobrando a sua aplicação com as Aplicações Web Estáticas do Azure\n\n### Passo 1: **Create Azure static web apps (Criar Aplicações Web Estáticas do Azure)**\n\n1. Navegue até o [Azure Portal](https://portal.azure.com/).\n2. Clique **Create a Resource (Criar um Recurso)** depois procure por **Aplicação Estática (Static App)** e selecione ela.\n3. Selecione uma subscrição a partir da lista suspensa *Subscription (Subscrição)* ou use a padrão.\n4. Clique na ligação **New (Novo)** por baixo do *Resource Group (Grupo de Recurso)* suspenso. No *New resource group name (Novo nome de grupo de recurso)*, digite **nuxt** e clique em **OK**\n5. Forneça nome globalmente único para a sua aplicação dentro da caixa de texto **Name (Nome)**. Caracteres válidos incluem `a-z`, `A-Z`, `0-9`, e `-`. O nome da aplicação é usado para identificar a aplicação dentro da sua lista de recursos logo é uma boa ideia nomear a sua aplicação usando o nome do seu repositório.\n6. Dentro da lista suspensa **Region (Região)**, escolha a região mais próxima de você.\n\n![O recurso do Azure Portal e a configuração da aplicação](https://user-images.githubusercontent.com/13063165/82118135-71891b00-9775-11ea-8284-aa94d17a3bc3.png)\n\n### Passo 2: **Adicionar um repositório do GitHub**\n\nA Aplicação de Serviço Estático da Aplicação do Azure precisa de acesso ao repositório onde a sua aplicação Nuxt mora, assim ele pode desdobrar consolidações automaticamente: \n\n1. Clique no **Botão Iniciar Sessão com o GitHub (Sign in with GitHub)**\n2. Selecione a **Organização (Organization)** sob a qual você criou o repositório para o seu projeto Nuxt. Também pode ser o nome de usuário do seu GitHub.\n3. Encontre o nome do repositório qye você criou mais cedo e selecione ele.\n4. Escolha o **master** como o ramo a partir da sua lista suspensa *Ramo (Branch)*.\n\n![Como adicionar o GitHub](https://user-images.githubusercontent.com/13063165/82118359-38ea4100-9777-11ea-9c5e-7ba5c4da708e.png)\n\n### Passo 3: **Configurar o processo de construção**\n\nHá poucas coisas que a Aplicação de Serviço Estático da Aplicação do Azure pode assumir - coisas como instalar automaticamente os módulos do npm e executar o comando `npm run build`. Há também poucas coisas sobre as quais você tem de ser explícito, como para qual pasta a aplicação estática será copiada depois da construção para que o sítio estático possa ser servido a partir de lá.\n\n1. Clique na aba **Construção (Build)** para configurar a pasta de saída do estático.\n2. Digite **dist** dentro da caixa de texto *Localização do Artefacto da Aplicação (App artifact location)*.\n\n![A configuração da construção do Azure Portal](https://user-images.githubusercontent.com/13063165/82118277-71d5e600-9776-11ea-88ad-48cf0793905d.png)\n\n### Passo 4: **Revisar e criar**\n\n1. Clique no botão **Revisar + Criar (Review + Create)** para verificar se os detalhes estão todos corretos.\n2. Clique em **Criar (Create)** para iniciar a criação do recurso e também provisionar uma GitHub Action para desdobramento.\n3. Uma vez que o desdobramento estiver completado, clique em **Ir para o recurso (Go to resource)**\n\n![A mensagem completa do desdobramento do Azure Portal](https://user-images.githubusercontent.com/13063165/82118390-67681c00-9777-11ea-9778-671dc768393e.png)\n\n4. Na tela do recurso, clique na ligação da *URL* para abrir a sua aplicação desdobrada.\n\n![A tela do recurso com a URL para a sua aplicação desdobrada](https://user-images.githubusercontent.com/13063165/82118042-d001c980-9774-11ea-94f5-57d995aa5391.png)\n\nParabéns, seu sítio estático está agora hospedado nas Aplicações Web Estáticas do Azure.\n\n## Reconstruir a sua aplicação estática e monitorar o desdobramento\n\nAgora tudo o que você tem de fazer é modificar o seu código e empurrar suas mudanças. Empurrar suas mudanças ativará uma GitHub Action e o seu novo sítio será automaticamente reconstruido. Você pode monitorar o fluxo de trabalho clicando na aba de ações dentro do seu repositório do GitHub e você pode inspecionar mais além selecionando a última consolidação que você fez. Você pode depois observar para ver quando o desdobrar é terminado ou inspecionar o registo se você tiver alguns erros de desdobramento. \n\n![A tela das ações do GitHub](https://user-images.githubusercontent.com/13063165/82118249-34715880-9776-11ea-92e2-dbd21bbf7cb6.png)\n\n## Você sabia?\n\n### **Como manipular rotas dinâmicas**\n\nSe você estiver trabalhando com páginas dinâmicas tais como `_id.vue` então você precisará adicionar essas rotas na propriedade `generate` dentro da configuração do Nuxt.\n\n[Consulte a documentação em como manipular rotas dinâmicas.](/docs/configuration-glossary/configuration-generate#routes)\n\n<div class=\"Alert\">\nSe você estiver usando o Nuxt 2.13+ então você não terá que preocupar-se com isso visto que existe um rastreador embutido que rastreará todas dinâmicas ao rastrear as ligações dentro do seu sítio.\n</div>\n\n### Como adicionar uma página de erro\n\nNo sentido de não ter a página 404 padrão você pode criar um ficheiro `error.vue` dentro da sua pasta layouts.\n\n### Como adicionar retorno de Aplicação de Página Única\n\nSe você gostaria que algumas páginas não sejam geradas mas que comportem-se como uma aplicação de página única você pode isso usando a propriedade `generate.excludes` dentro do seu ficheiro `nuxt.config.js`.\n\n[Consulte a documentação em retorno de aplicação de página única](/docs/configuration-glossary/configuration-generate#exclude)\n","ast":{"type":"root","children":[{"type":"element","tag":"prose-h1","props":{"class":"d-heading-title","id":"desdobrar-no-azure-static-web-apps"},"children":[{"type":"text","value":"Desdobrar no Azure Static Web Apps"}]},{"type":"text","value":"\n"},{"type":"element","tag":"prose-paragraph","props":{"class":"d-heading-description"},"children":[{"type":"text","value":"Como desdobrar uma aplicação Nuxt no Azure Static Web Apps?"}]},{"type":"text","value":"\n"},{"type":"element","tag":"prose-hr","props":{"class":"d-heading-hr"},"children":[]},{"type":"text","value":"\n"},{"type":"element","tag":"prose-paragraph","props":{},"children":[{"type":"text","value":"Você podo agora desdobrar os seus sítios estáticos no Azure usando Aplicações Web Estáticas do Azure. Você precisará ter a sua aplicação dentro do GitHub visto que o Aplicações Web Estáticas do Azure influencia o GitHub Actions o qual permite você reconstruir seu sítio estático em todo "},{"type":"element","tag":"prose-code-inline","props":{},"children":[{"type":"text","value":"git push"}]},{"type":"text","value":"."}]},{"type":"text","value":"\n"},{"type":"element","tag":"prose-paragraph","props":{},"children":[{"type":"text","value":"Existem duas coisas que você precisa configurar no sentido de desdobrar a sua aplicação no Aplicações Web Estáticas do Azure. A primeira é modificar o comando de construção visto que o Azure lê o comando de construção do seu package.json e para os sítios estáticos precisamos usar o comando de geração."}]},{"type":"text","value":"\n"},{"type":"element","tag":"prose-paragraph","props":{},"children":[{"type":"element","tag":"prose-code-inline","props":{},"children":[{"type":"text","value":"package.json"}]}]},{"type":"text","value":"\n"},{"type":"element","tag":"prose-code","props":{},"children":[{"type":"element","tag":"pre","props":{"className":["line-numbers","language-json"]},"children":[{"type":"element","tag":"code","props":{},"children":[{"type":"text","value":"build"},{"type":"element","tag":"span","props":{"className":["token","operator"]},"children":[{"type":"text","value":":"}]},{"type":"text","value":" "},{"type":"element","tag":"span","props":{"className":["token","string"]},"children":[{"type":"text","value":"\"nuxt generate\""}]},{"type":"text","value":"\n"}]}]}]},{"type":"text","value":"\n"},{"type":"element","tag":"prose-paragraph","props":{},"children":[{"type":"text","value":"A segunda é adicionar um ficheiro routes.json o qual é importante para captura de páginas 404 personalizadas e páginas de retornos das aplicações de páginas única."}]},{"type":"text","value":"\n"},{"type":"element","tag":"prose-paragraph","props":{},"children":[{"type":"element","tag":"prose-code-inline","props":{},"children":[{"type":"text","value":"static/routes.json"}]}]},{"type":"text","value":"\n"},{"type":"element","tag":"prose-code","props":{},"children":[{"type":"element","tag":"pre","props":{"className":["line-numbers","language-jsx"]},"children":[{"type":"element","tag":"code","props":{},"children":[{"type":"element","tag":"span","props":{"className":["token","punctuation"]},"children":[{"type":"text","value":"{"}]},{"type":"text","value":"\n "},{"type":"element","tag":"span","props":{"className":["token","string"]},"children":[{"type":"text","value":"\"routes\""}]},{"type":"element","tag":"span","props":{"className":["token","operator"]},"children":[{"type":"text","value":":"}]},{"type":"text","value":" "},{"type":"element","tag":"span","props":{"className":["token","punctuation"]},"children":[{"type":"text","value":"["}]},{"type":"element","tag":"span","props":{"className":["token","punctuation"]},"children":[{"type":"text","value":"]"}]},{"type":"element","tag":"span","props":{"className":["token","punctuation"]},"children":[{"type":"text","value":","}]},{"type":"text","value":"\n "},{"type":"element","tag":"span","props":{"className":["token","string"]},"children":[{"type":"text","value":"\"platformErrorOverrides\""}]},{"type":"element","tag":"span","props":{"className":["token","operator"]},"children":[{"type":"text","value":":"}]},{"type":"text","value":" "},{"type":"element","tag":"span","props":{"className":["token","punctuation"]},"children":[{"type":"text","value":"["}]},{"type":"text","value":"\n   "},{"type":"element","tag":"span","props":{"className":["token","punctuation"]},"children":[{"type":"text","value":"{"}]},{"type":"text","value":"\n    "},{"type":"element","tag":"span","props":{"className":["token","string"]},"children":[{"type":"text","value":"\"errorType\""}]},{"type":"element","tag":"span","props":{"className":["token","operator"]},"children":[{"type":"text","value":":"}]},{"type":"text","value":" "},{"type":"element","tag":"span","props":{"className":["token","string"]},"children":[{"type":"text","value":"\"NotFound\""}]},{"type":"element","tag":"span","props":{"className":["token","punctuation"]},"children":[{"type":"text","value":","}]},{"type":"text","value":"\n    "},{"type":"element","tag":"span","props":{"className":["token","string"]},"children":[{"type":"text","value":"\"serve\""}]},{"type":"element","tag":"span","props":{"className":["token","operator"]},"children":[{"type":"text","value":":"}]},{"type":"text","value":" "},{"type":"element","tag":"span","props":{"className":["token","string"]},"children":[{"type":"text","value":"\"/200.html\""}]},{"type":"element","tag":"span","props":{"className":["token","punctuation"]},"children":[{"type":"text","value":","}]},{"type":"text","value":"\n    "},{"type":"element","tag":"span","props":{"className":["token","string"]},"children":[{"type":"text","value":"\"statusCode\""}]},{"type":"element","tag":"span","props":{"className":["token","operator"]},"children":[{"type":"text","value":":"}]},{"type":"text","value":" "},{"type":"element","tag":"span","props":{"className":["token","number"]},"children":[{"type":"text","value":"200"}]},{"type":"text","value":"\n   "},{"type":"element","tag":"span","props":{"className":["token","punctuation"]},"children":[{"type":"text","value":"}"}]},{"type":"text","value":"\n "},{"type":"element","tag":"span","props":{"className":["token","punctuation"]},"children":[{"type":"text","value":"]"}]},{"type":"text","value":"\n"},{"type":"element","tag":"span","props":{"className":["token","punctuation"]},"children":[{"type":"text","value":"}"}]},{"type":"text","value":"\n"}]}]}]},{"type":"text","value":"\n"},{"type":"element","tag":"prose-paragraph","props":{},"children":[{"type":"text","value":"Se você quiser testar desdobrando para as Aplicações Web Estáticas do Azure, nós temos criado uma pequena aplicação de demonstração que está toda organizada e configurada. Você apenas precisará clonar ela e adicionar ela ao seu repositório do GitHub. Você pode depois seguir os passos adiante - Desdobrando a sua aplicação com as Aplicações Web Estáticas do Azure."}]},{"type":"text","value":"\n"},{"type":"element","tag":"prose-paragraph","props":{},"children":[{"type":"element","tag":"prose-a","props":{"href":"https://github.com/debs-obrien/nuxtjs-azure-static-app","rel":["nofollow","noopener","noreferrer"],"target":"_blank"},"children":[{"type":"text","value":"Clonar a aplicação de demonstração"}]}]},{"type":"text","value":"\n"},{"type":"element","tag":"prose-h2","props":{"id":"desdobrando-a-sua-aplicação-com-as-aplicações-web-estáticas-do-azure"},"children":[{"type":"element","tag":"prose-a","props":{"href":"#desdobrando-a-sua-aplica%C3%A7%C3%A3o-com-as-aplica%C3%A7%C3%B5es-web-est%C3%A1ticas-do-azure"},"children":[{"type":"text","value":"Desdobrando a sua aplicação com as Aplicações Web Estáticas do Azure"}]}]},{"type":"text","value":"\n"},{"type":"element","tag":"prose-h3","props":{"id":"passo-1-create-azure-static-web-apps-criar-aplicações-web-estáticas-do-azure"},"children":[{"type":"element","tag":"prose-a","props":{"href":"#passo-1-create-azure-static-web-apps-criar-aplica%C3%A7%C3%B5es-web-est%C3%A1ticas-do-azure"},"children":[{"type":"text","value":"Passo 1: "},{"type":"element","tag":"prose-strong","props":{},"children":[{"type":"text","value":"Create Azure static web apps (Criar Aplicações Web Estáticas do Azure)"}]}]}]},{"type":"text","value":"\n"},{"type":"element","tag":"prose-ol","props":{},"children":[{"type":"text","value":"\n"},{"type":"element","tag":"prose-li","props":{},"children":[{"type":"text","value":"\n"},{"type":"text","value":"Navegue até o "},{"type":"element","tag":"prose-a","props":{"href":"https://portal.azure.com/","rel":["nofollow","noopener","noreferrer"],"target":"_blank"},"children":[{"type":"text","value":"Azure Portal"}]},{"type":"text","value":"."},{"type":"text","value":"\n"}]},{"type":"text","value":"\n"},{"type":"element","tag":"prose-li","props":{},"children":[{"type":"text","value":"\n"},{"type":"text","value":"Clique "},{"type":"element","tag":"prose-strong","props":{},"children":[{"type":"text","value":"Create a Resource (Criar um Recurso)"}]},{"type":"text","value":" depois procure por "},{"type":"element","tag":"prose-strong","props":{},"children":[{"type":"text","value":"Aplicação Estática (Static App)"}]},{"type":"text","value":" e selecione ela."},{"type":"text","value":"\n"}]},{"type":"text","value":"\n"},{"type":"element","tag":"prose-li","props":{},"children":[{"type":"text","value":"\n"},{"type":"text","value":"Selecione uma subscrição a partir da lista suspensa "},{"type":"element","tag":"prose-em","props":{},"children":[{"type":"text","value":"Subscription (Subscrição)"}]},{"type":"text","value":" ou use a padrão."},{"type":"text","value":"\n"}]},{"type":"text","value":"\n"},{"type":"element","tag":"prose-li","props":{},"children":[{"type":"text","value":"\n"},{"type":"text","value":"Clique na ligação "},{"type":"element","tag":"prose-strong","props":{},"children":[{"type":"text","value":"New (Novo)"}]},{"type":"text","value":" por baixo do "},{"type":"element","tag":"prose-em","props":{},"children":[{"type":"text","value":"Resource Group (Grupo de Recurso)"}]},{"type":"text","value":" suspenso. No "},{"type":"element","tag":"prose-em","props":{},"children":[{"type":"text","value":"New resource group name (Novo nome de grupo de recurso)"}]},{"type":"text","value":", digite "},{"type":"element","tag":"prose-strong","props":{},"children":[{"type":"text","value":"nuxt"}]},{"type":"text","value":" e clique em "},{"type":"element","tag":"prose-strong","props":{},"children":[{"type":"text","value":"OK"}]},{"type":"text","value":"\n"}]},{"type":"text","value":"\n"},{"type":"element","tag":"prose-li","props":{},"children":[{"type":"text","value":"\n"},{"type":"text","value":"Forneça nome globalmente único para a sua aplicação dentro da caixa de texto "},{"type":"element","tag":"prose-strong","props":{},"children":[{"type":"text","value":"Name (Nome)"}]},{"type":"text","value":". Caracteres válidos incluem "},{"type":"element","tag":"prose-code-inline","props":{},"children":[{"type":"text","value":"a-z"}]},{"type":"text","value":", "},{"type":"element","tag":"prose-code-inline","props":{},"children":[{"type":"text","value":"A-Z"}]},{"type":"text","value":", "},{"type":"element","tag":"prose-code-inline","props":{},"children":[{"type":"text","value":"0-9"}]},{"type":"text","value":", e "},{"type":"element","tag":"prose-code-inline","props":{},"children":[{"type":"text","value":"-"}]},{"type":"text","value":". O nome da aplicação é usado para identificar a aplicação dentro da sua lista de recursos logo é uma boa ideia nomear a sua aplicação usando o nome do seu repositório."},{"type":"text","value":"\n"}]},{"type":"text","value":"\n"},{"type":"element","tag":"prose-li","props":{},"children":[{"type":"text","value":"\n"},{"type":"text","value":"Dentro da lista suspensa "},{"type":"element","tag":"prose-strong","props":{},"children":[{"type":"text","value":"Region (Região)"}]},{"type":"text","value":", escolha a região mais próxima de você."},{"type":"text","value":"\n"}]},{"type":"text","value":"\n"}]},{"type":"text","value":"\n"},{"type":"element","tag":"prose-paragraph","props":{},"children":[{"type":"element","tag":"prose-img","props":{"alt":"O recurso do Azure Portal e a configuração da aplicação","src":"https://user-images.githubusercontent.com/13063165/82118135-71891b00-9775-11ea-8284-aa94d17a3bc3.png"},"children":[]}]},{"type":"text","value":"\n"},{"type":"element","tag":"prose-h3","props":{"id":"passo-2-adicionar-um-repositório-do-github"},"children":[{"type":"element","tag":"prose-a","props":{"href":"#passo-2-adicionar-um-reposit%C3%B3rio-do-github"},"children":[{"type":"text","value":"Passo 2: "},{"type":"element","tag":"prose-strong","props":{},"children":[{"type":"text","value":"Adicionar um repositório do GitHub"}]}]}]},{"type":"text","value":"\n"},{"type":"element","tag":"prose-paragraph","props":{},"children":[{"type":"text","value":"A Aplicação de Serviço Estático da Aplicação do Azure precisa de acesso ao repositório onde a sua aplicação Nuxt mora, assim ele pode desdobrar consolidações automaticamente:"}]},{"type":"text","value":"\n"},{"type":"element","tag":"prose-ol","props":{},"children":[{"type":"text","value":"\n"},{"type":"element","tag":"prose-li","props":{},"children":[{"type":"text","value":"\n"},{"type":"text","value":"Clique no "},{"type":"element","tag":"prose-strong","props":{},"children":[{"type":"text","value":"Botão Iniciar Sessão com o GitHub (Sign in with GitHub)"}]},{"type":"text","value":"\n"}]},{"type":"text","value":"\n"},{"type":"element","tag":"prose-li","props":{},"children":[{"type":"text","value":"\n"},{"type":"text","value":"Selecione a "},{"type":"element","tag":"prose-strong","props":{},"children":[{"type":"text","value":"Organização (Organization)"}]},{"type":"text","value":" sob a qual você criou o repositório para o seu projeto Nuxt. Também pode ser o nome de usuário do seu GitHub."},{"type":"text","value":"\n"}]},{"type":"text","value":"\n"},{"type":"element","tag":"prose-li","props":{},"children":[{"type":"text","value":"\n"},{"type":"text","value":"Encontre o nome do repositório qye você criou mais cedo e selecione ele."},{"type":"text","value":"\n"}]},{"type":"text","value":"\n"},{"type":"element","tag":"prose-li","props":{},"children":[{"type":"text","value":"\n"},{"type":"text","value":"Escolha o "},{"type":"element","tag":"prose-strong","props":{},"children":[{"type":"text","value":"master"}]},{"type":"text","value":" como o ramo a partir da sua lista suspensa "},{"type":"element","tag":"prose-em","props":{},"children":[{"type":"text","value":"Ramo (Branch)"}]},{"type":"text","value":"."},{"type":"text","value":"\n"}]},{"type":"text","value":"\n"}]},{"type":"text","value":"\n"},{"type":"element","tag":"prose-paragraph","props":{},"children":[{"type":"element","tag":"prose-img","props":{"alt":"Como adicionar o GitHub","src":"https://user-images.githubusercontent.com/13063165/82118359-38ea4100-9777-11ea-9c5e-7ba5c4da708e.png"},"children":[]}]},{"type":"text","value":"\n"},{"type":"element","tag":"prose-h3","props":{"id":"passo-3-configurar-o-processo-de-construção"},"children":[{"type":"element","tag":"prose-a","props":{"href":"#passo-3-configurar-o-processo-de-constru%C3%A7%C3%A3o"},"children":[{"type":"text","value":"Passo 3: "},{"type":"element","tag":"prose-strong","props":{},"children":[{"type":"text","value":"Configurar o processo de construção"}]}]}]},{"type":"text","value":"\n"},{"type":"element","tag":"prose-paragraph","props":{},"children":[{"type":"text","value":"Há poucas coisas que a Aplicação de Serviço Estático da Aplicação do Azure pode assumir - coisas como instalar automaticamente os módulos do npm e executar o comando "},{"type":"element","tag":"prose-code-inline","props":{},"children":[{"type":"text","value":"npm run build"}]},{"type":"text","value":". Há também poucas coisas sobre as quais você tem de ser explícito, como para qual pasta a aplicação estática será copiada depois da construção para que o sítio estático possa ser servido a partir de lá."}]},{"type":"text","value":"\n"},{"type":"element","tag":"prose-ol","props":{},"children":[{"type":"text","value":"\n"},{"type":"element","tag":"prose-li","props":{},"children":[{"type":"text","value":"\n"},{"type":"text","value":"Clique na aba "},{"type":"element","tag":"prose-strong","props":{},"children":[{"type":"text","value":"Construção (Build)"}]},{"type":"text","value":" para configurar a pasta de saída do estático."},{"type":"text","value":"\n"}]},{"type":"text","value":"\n"},{"type":"element","tag":"prose-li","props":{},"children":[{"type":"text","value":"\n"},{"type":"text","value":"Digite "},{"type":"element","tag":"prose-strong","props":{},"children":[{"type":"text","value":"dist"}]},{"type":"text","value":" dentro da caixa de texto "},{"type":"element","tag":"prose-em","props":{},"children":[{"type":"text","value":"Localização do Artefacto da Aplicação (App artifact location)"}]},{"type":"text","value":"."},{"type":"text","value":"\n"}]},{"type":"text","value":"\n"}]},{"type":"text","value":"\n"},{"type":"element","tag":"prose-paragraph","props":{},"children":[{"type":"element","tag":"prose-img","props":{"alt":"A configuração da construção do Azure Portal","src":"https://user-images.githubusercontent.com/13063165/82118277-71d5e600-9776-11ea-88ad-48cf0793905d.png"},"children":[]}]},{"type":"text","value":"\n"},{"type":"element","tag":"prose-h3","props":{"id":"passo-4-revisar-e-criar"},"children":[{"type":"element","tag":"prose-a","props":{"href":"#passo-4-revisar-e-criar"},"children":[{"type":"text","value":"Passo 4: "},{"type":"element","tag":"prose-strong","props":{},"children":[{"type":"text","value":"Revisar e criar"}]}]}]},{"type":"text","value":"\n"},{"type":"element","tag":"prose-ol","props":{},"children":[{"type":"text","value":"\n"},{"type":"element","tag":"prose-li","props":{},"children":[{"type":"text","value":"\n"},{"type":"text","value":"Clique no botão "},{"type":"element","tag":"prose-strong","props":{},"children":[{"type":"text","value":"Revisar + Criar (Review + Create)"}]},{"type":"text","value":" para verificar se os detalhes estão todos corretos."},{"type":"text","value":"\n"}]},{"type":"text","value":"\n"},{"type":"element","tag":"prose-li","props":{},"children":[{"type":"text","value":"\n"},{"type":"text","value":"Clique em "},{"type":"element","tag":"prose-strong","props":{},"children":[{"type":"text","value":"Criar (Create)"}]},{"type":"text","value":" para iniciar a criação do recurso e também provisionar uma GitHub Action para desdobramento."},{"type":"text","value":"\n"}]},{"type":"text","value":"\n"},{"type":"element","tag":"prose-li","props":{},"children":[{"type":"text","value":"\n"},{"type":"text","value":"Uma vez que o desdobramento estiver completado, clique em "},{"type":"element","tag":"prose-strong","props":{},"children":[{"type":"text","value":"Ir para o recurso (Go to resource)"}]},{"type":"text","value":"\n"}]},{"type":"text","value":"\n"}]},{"type":"text","value":"\n"},{"type":"element","tag":"prose-paragraph","props":{},"children":[{"type":"element","tag":"prose-img","props":{"alt":"A mensagem completa do desdobramento do Azure Portal","src":"https://user-images.githubusercontent.com/13063165/82118390-67681c00-9777-11ea-9778-671dc768393e.png"},"children":[]}]},{"type":"text","value":"\n"},{"type":"element","tag":"prose-ol","props":{"start":4},"children":[{"type":"text","value":"\n"},{"type":"element","tag":"prose-li","props":{},"children":[{"type":"text","value":"\n"},{"type":"text","value":"Na tela do recurso, clique na ligação da "},{"type":"element","tag":"prose-em","props":{},"children":[{"type":"text","value":"URL"}]},{"type":"text","value":" para abrir a sua aplicação desdobrada."},{"type":"text","value":"\n"}]},{"type":"text","value":"\n"}]},{"type":"text","value":"\n"},{"type":"element","tag":"prose-paragraph","props":{},"children":[{"type":"element","tag":"prose-img","props":{"alt":"A tela do recurso com a URL para a sua aplicação desdobrada","src":"https://user-images.githubusercontent.com/13063165/82118042-d001c980-9774-11ea-94f5-57d995aa5391.png"},"children":[]}]},{"type":"text","value":"\n"},{"type":"element","tag":"prose-paragraph","props":{},"children":[{"type":"text","value":"Parabéns, seu sítio estático está agora hospedado nas Aplicações Web Estáticas do Azure."}]},{"type":"text","value":"\n"},{"type":"element","tag":"prose-h2","props":{"id":"reconstruir-a-sua-aplicação-estática-e-monitorar-o-desdobramento"},"children":[{"type":"element","tag":"prose-a","props":{"href":"#reconstruir-a-sua-aplica%C3%A7%C3%A3o-est%C3%A1tica-e-monitorar-o-desdobramento"},"children":[{"type":"text","value":"Reconstruir a sua aplicação estática e monitorar o desdobramento"}]}]},{"type":"text","value":"\n"},{"type":"element","tag":"prose-paragraph","props":{},"children":[{"type":"text","value":"Agora tudo o que você tem de fazer é modificar o seu código e empurrar suas mudanças. Empurrar suas mudanças ativará uma GitHub Action e o seu novo sítio será automaticamente reconstruido. Você pode monitorar o fluxo de trabalho clicando na aba de ações dentro do seu repositório do GitHub e você pode inspecionar mais além selecionando a última consolidação que você fez. Você pode depois observar para ver quando o desdobrar é terminado ou inspecionar o registo se você tiver alguns erros de desdobramento."}]},{"type":"text","value":"\n"},{"type":"element","tag":"prose-paragraph","props":{},"children":[{"type":"element","tag":"prose-img","props":{"alt":"A tela das ações do GitHub","src":"https://user-images.githubusercontent.com/13063165/82118249-34715880-9776-11ea-92e2-dbd21bbf7cb6.png"},"children":[]}]},{"type":"text","value":"\n"},{"type":"element","tag":"prose-h2","props":{"id":"você-sabia"},"children":[{"type":"element","tag":"prose-a","props":{"href":"#voc%C3%AA-sabia"},"children":[{"type":"text","value":"Você sabia?"}]}]},{"type":"text","value":"\n"},{"type":"element","tag":"prose-h3","props":{"id":"como-manipular-rotas-dinâmicas"},"children":[{"type":"element","tag":"prose-a","props":{"href":"#como-manipular-rotas-din%C3%A2micas"},"children":[{"type":"element","tag":"prose-strong","props":{},"children":[{"type":"text","value":"Como manipular rotas dinâmicas"}]}]}]},{"type":"text","value":"\n"},{"type":"element","tag":"prose-paragraph","props":{},"children":[{"type":"text","value":"Se você estiver trabalhando com páginas dinâmicas tais como "},{"type":"element","tag":"prose-code-inline","props":{},"children":[{"type":"text","value":"_id.vue"}]},{"type":"text","value":" então você precisará adicionar essas rotas na propriedade "},{"type":"element","tag":"prose-code-inline","props":{},"children":[{"type":"text","value":"generate"}]},{"type":"text","value":" dentro da configuração do Nuxt."}]},{"type":"text","value":"\n"},{"type":"element","tag":"prose-paragraph","props":{},"children":[{"type":"element","tag":"prose-a","props":{"href":"/docs/configuration-glossary/configuration-generate#routes"},"children":[{"type":"text","value":"Consulte a documentação em como manipular rotas dinâmicas."}]}]},{"type":"text","value":"\n"},{"type":"element","tag":"div","props":{"className":["Alert"]},"children":[{"type":"text","value":"\nSe você estiver usando o Nuxt 2.13+ então você não terá que preocupar-se com isso visto que existe um rastreador embutido que rastreará todas dinâmicas ao rastrear as ligações dentro do seu sítio.\n"}]},{"type":"text","value":"\n"},{"type":"element","tag":"prose-h3","props":{"id":"como-adicionar-uma-página-de-erro"},"children":[{"type":"element","tag":"prose-a","props":{"href":"#como-adicionar-uma-p%C3%A1gina-de-erro"},"children":[{"type":"text","value":"Como adicionar uma página de erro"}]}]},{"type":"text","value":"\n"},{"type":"element","tag":"prose-paragraph","props":{},"children":[{"type":"text","value":"No sentido de não ter a página 404 padrão você pode criar um ficheiro "},{"type":"element","tag":"prose-code-inline","props":{},"children":[{"type":"text","value":"error.vue"}]},{"type":"text","value":" dentro da sua pasta layouts."}]},{"type":"text","value":"\n"},{"type":"element","tag":"prose-h3","props":{"id":"como-adicionar-retorno-de-aplicação-de-página-única"},"children":[{"type":"element","tag":"prose-a","props":{"href":"#como-adicionar-retorno-de-aplica%C3%A7%C3%A3o-de-p%C3%A1gina-%C3%BAnica"},"children":[{"type":"text","value":"Como adicionar retorno de Aplicação de Página Única"}]}]},{"type":"text","value":"\n"},{"type":"element","tag":"prose-paragraph","props":{},"children":[{"type":"text","value":"Se você gostaria que algumas páginas não sejam geradas mas que comportem-se como uma aplicação de página única você pode isso usando a propriedade "},{"type":"element","tag":"prose-code-inline","props":{},"children":[{"type":"text","value":"generate.excludes"}]},{"type":"text","value":" dentro do seu ficheiro "},{"type":"element","tag":"prose-code-inline","props":{},"children":[{"type":"text","value":"nuxt.config.js"}]},{"type":"text","value":"."}]},{"type":"text","value":"\n"},{"type":"element","tag":"prose-paragraph","props":{},"children":[{"type":"element","tag":"prose-a","props":{"href":"/docs/configuration-glossary/configuration-generate#exclude"},"children":[{"type":"text","value":"Consulte a documentação em retorno de aplicação de página única"}]}]}]},"toc":{"title":"","searchDepth":2,"depth":2,"links":[{"id":"desdobrando-a-sua-aplicação-com-as-aplicações-web-estáticas-do-azure","depth":2,"text":"Desdobrando a sua aplicação com as Aplicações Web Estáticas do Azure","children":[{"id":"passo-1-create-azure-static-web-apps-criar-aplicações-web-estáticas-do-azure","depth":3,"text":"Passo 1: Create Azure static web apps (Criar Aplicações Web Estáticas do Azure)"},{"id":"passo-2-adicionar-um-repositório-do-github","depth":3,"text":"Passo 2: Adicionar um repositório do GitHub"},{"id":"passo-3-configurar-o-processo-de-construção","depth":3,"text":"Passo 3: Configurar o processo de construção"},{"id":"passo-4-revisar-e-criar","depth":3,"text":"Passo 4: Revisar e criar"}]},{"id":"reconstruir-a-sua-aplicação-estática-e-monitorar-o-desdobramento","depth":2,"text":"Reconstruir a sua aplicação estática e monitorar o desdobramento"},{"id":"você-sabia","depth":2,"text":"Você sabia?","children":[{"id":"como-manipular-rotas-dinâmicas","depth":3,"text":"Como manipular rotas dinâmicas"},{"id":"como-adicionar-uma-página-de-erro","depth":3,"text":"Como adicionar uma página de erro"},{"id":"como-adicionar-retorno-de-aplicação-de-página-única","depth":3,"text":"Como adicionar retorno de Aplicação de Página Única"}]}]}}}