{"key":"content:fr:deployments:azure-static-web-apps.md","generatedAt":"2022-03-15T12:42:45.812Z","mtime":"2022-03-15T12:42:45.796Z","slug":"azure-static-web-apps","title":"Azure Static Web Apps","position":"999999990000","to":"/deployments/azure-static-web-apps","draft":false,"page":true,"language":"fr","template":"guide","description":"Comment déployer une application Nuxt sur Azure Static Web Apps ?","target":"Static","category":"deployment","logo":{"light":"/img/companies/square/light/Azure.svg","dark":"/img/companies/square/dark/Azure.svg"},"empty":false,"body":{"raw":"---\ntemplate: guide\ntitle: Azure Static Web Apps\ndescription: Comment déployer une application Nuxt sur Azure Static Web Apps ?\ntarget: Static\ncategory: deployment\nlogo:\n  light: \"/img/companies/square/light/Azure.svg\"\n  dark: \"/img/companies/square/dark/Azure.svg\"\n---\n# Déployer Nuxt sur Azure Static Web App\n\nComment déployer une application Nuxt sur Azure Static Web Apps ?\n\n---\n\nVous pouvez maintenant déployer vos sites statiques sur Azure à l'aide d'applications web statiques. Vous devrez avoir votre application dans GitHub car les applications web statiques Azure exploitent les actions GitHub qui vous permettent de reconstruire votre site statique à chaque commit poussée sur git.\n\nIl y a 2 choses que vous devez configurer dans le but de déployer votre application sur des applications web statiques Azure. La première consiste à modifier la commande de build afin qu'Azure puisse lire la commande de build à partir de votre package.json et pour les sites statiques, nous devons utiliser la commande generate.\n\n`package.json`\n\n```json\nbuild: \"nuxt generate\"\n```\n\nLa seconde consiste à ajouter un fichier `routes.json` qui est important pour capturer les pages 404 personnalisées et les pages de secours du SPA.\n\n`static/routes.json`\n\n```jsx\n{\n \"routes\": [],\n \"platformErrorOverrides\": [\n   {\n    \"errorType\": \"NotFound\",\n    \"serve\": \"/200.html\",\n    \"statusCode\": 200\n   }\n ]\n}\n```\n\nSi vous souhaitez tester le déploiement sur des applications Web statiques Azure, nous avons créé une petite application de démonstration entièrement installée et configurée. Vous aurez juste besoin de le cloner et de l'ajouter à votre dépôt GitHub. Vous pouvez ensuite suivre les étapes de - Déploiement de votre application avec Azure Static Web Apps.\n\n[Cloner l'application de démonstration](https://github.com/debs-obrien/nuxtjs-azure-static-app)\n\n## Déploiement de votre application avec Azure Static Web Apps\n\n### Étape 1 : **Créez des applications Web statiques Azure**\n\n1. Accédez au [Portail Azure](https://portal.azure.com/).\n2. Cliquez sur **Créer une ressource**, puis recherchez **Application statique** et sélectionnez-la.\n3. Sélectionnez un abonnement dans la liste déroulante *Abonnement* ou utilisez celui par défaut.\n4. Cliquez sur le lien **Nouveau** sous la liste déroulante *Groupe de ressources*. Dans *Nom du nouveau groupe de ressources*, saisissez **nuxt** et cliquez sur **OK**\n5. Fournissez un nom unique pour votre application dans la zone de texte **Nom**. Les caractères valides incluent `a-z`, `A-Z`, `0-9` et `-`. Le nom de l'application est utilisé pour identifier l'application dans votre liste de ressources, c'est donc une bonne idée de nommer votre application en utilisant le nom de votre projet.\n6. Dans la liste déroulante *Région*, choisissez une région la plus proche de vous.\n![Configuration des ressources et de l'application du portail Azure](https://user-images.githubusercontent.com/13063165/82118135-71891b00-9775-11ea-8284-aa94d17a3bc3.png)\n\n### Étape 2: **Ajouter un dépôt GitHub**\n\nL'application statique Azure App Service a besoin d'accéder au dépôt où réside votre application Nuxt afin qu'elle puisse déployer automatiquement des commits :\n\n1. Cliquez sur le bouton **Se connecter avec GitHub**\n2. Sélectionnez l'**Organisation** sous laquelle vous avez créé le dépôt pour votre projet Nuxt. Il peut également s'agir de votre nom d'utilisateur GitHub.\n3. Recherchez le nom du dépôt que vous avez créé précédemment et sélectionnez-le.\n4. Choisissez **master** comme branche dans la liste déroulante *Branche*.\n\n![Comment ajouter sur github](https://user-images.githubusercontent.com/13063165/82118359-38ea4100-9777-11ea-9c5e-7ba5c4da708e.png)\n\n### Étape 3: **Configurer le processus de construction**\n\nIl y a des choses que l'application statique Azure App Service peut deviner - des choses comme l'installation automatique des modules npm et l'exécution de `npm run build`. Il y a aussi des choses sur lesquelles vous devez être explicite, comme le dossier dans lequel l'application statique sera copiée après la construction afin que le site statique puisse être servi à partir de là.\n\n1. Cliquez sur l'onglet **Construction** pour configurer le dossier de sortie statique.\n2. Saisissez **dist** dans la zone de texte *Emplacement de l'artefact de l'application*.\n\n![Configuration du portail Azure](https://user-images.githubusercontent.com/13063165/82118277-71d5e600-9776-11ea-88ad-48cf0793905d.png)\n\n### Étape 4: **Révisez et créez**\n\n1. Cliquez sur le bouton **Réviser + Créer** pour vérifier que tous les détails sont corrects.\n2. Cliquez sur **Créer** pour lancer la création de la ressource et également provisionner une action GitHub pour le déploiement.\n3. Une fois le déploiement terminé, cliquez sur **Aller à la ressource**\n\n![Message de fin de déploiement du portail Azure](https://user-images.githubusercontent.com/13063165/82118390-67681c00-9777-11ea-9778-671dc768393e.png)\n\n4. Sur l'écran des ressources, cliquez sur le lien *URL* pour ouvrir votre application déployée.\n\n![resource screen with url to your deployed app](https://user-images.githubusercontent.com/13063165/82118042-d001c980-9774-11ea-94f5-57d995aa5391.png)\n\nFélicitations, votre site statique est désormais hébergé sur des applications web statiques Azure.\n\n## Reconstruisez votre application statique en surveillant votre déploiement\n\nMaintenant, tout ce que vous avez à faire est de modifier votre code et de pousser vos modifications. Pousser vos modifications activera une action GitHub et votre nouveau site sera automatiquement reconstruit. Vous pouvez surveiller le flux de travail en cliquant sur l'onglet actions dans votre projet GitHub et inspecter davantage en sélectionnant le dernier commit que vous avez effectué. Vous pouvez ensuite regarder pour voir quand le déploiement est terminé ou inspecter le journal si vous avez des erreurs de déploiement.\n\n![Écran d'action GitHub](https://user-images.githubusercontent.com/13063165/82118249-34715880-9776-11ea-92e2-dbd21bbf7cb6.png)\n\n## Le saviez-vous ?\n\n### **Comment gérer les routes dynamiques**\n\nSi vous travaillez avec des pages dynamiques telles que `_id.vue`, vous devrez alors ajouter ces routes à la propriété generate dans votre configuration nuxt.\n\n[Voir la documentation sur la façon de gérer les routes dynamiques.](/docs/configuration-glossary/configuration-generate#routes)\n\n<div class=\"Alert\">\nSi vous utilisez Nuxt 2.13+, vous n'aurez pas à vous en soucier car il existe un robot d'exploration intégré qui explorera toutes les dynamiques en explorant les liens de votre site.\n</div>\n\n### Comment ajouter une page d'erreur\n\nDans le but de ne pas avoir la page 404 par défaut, vous pouvez créer un fichier `error.vue` dans votre dossier layouts.\n\n### Comment ajouter une solution de repli\n\nSi vous souhaitez que certaines pages ne soient pas générées mais agissent comme une application à page unique, vous pouvez le faire en utilisant la propriété generate.excludes dans votre fichier nuxt.config.\n\n[Voir la documentation sur les solutions de repli du SPA](/docs/configuration-glossary/configuration-generate#exclude)\n","ast":{"type":"root","children":[{"type":"element","tag":"prose-h1","props":{"class":"d-heading-title","id":"déployer-nuxt-sur-azure-static-web-app"},"children":[{"type":"text","value":"Déployer Nuxt sur Azure Static Web App"}]},{"type":"text","value":"\n"},{"type":"element","tag":"prose-paragraph","props":{"class":"d-heading-description"},"children":[{"type":"text","value":"Comment déployer une application Nuxt sur Azure Static Web Apps ?"}]},{"type":"text","value":"\n"},{"type":"element","tag":"prose-hr","props":{"class":"d-heading-hr"},"children":[]},{"type":"text","value":"\n"},{"type":"element","tag":"prose-paragraph","props":{},"children":[{"type":"text","value":"Vous pouvez maintenant déployer vos sites statiques sur Azure à l'aide d'applications web statiques. Vous devrez avoir votre application dans GitHub car les applications web statiques Azure exploitent les actions GitHub qui vous permettent de reconstruire votre site statique à chaque commit poussée sur git."}]},{"type":"text","value":"\n"},{"type":"element","tag":"prose-paragraph","props":{},"children":[{"type":"text","value":"Il y a 2 choses que vous devez configurer dans le but de déployer votre application sur des applications web statiques Azure. La première consiste à modifier la commande de build afin qu'Azure puisse lire la commande de build à partir de votre package.json et pour les sites statiques, nous devons utiliser la commande generate."}]},{"type":"text","value":"\n"},{"type":"element","tag":"prose-paragraph","props":{},"children":[{"type":"element","tag":"prose-code-inline","props":{},"children":[{"type":"text","value":"package.json"}]}]},{"type":"text","value":"\n"},{"type":"element","tag":"prose-code","props":{},"children":[{"type":"element","tag":"pre","props":{"className":["line-numbers","language-json"]},"children":[{"type":"element","tag":"code","props":{},"children":[{"type":"text","value":"build"},{"type":"element","tag":"span","props":{"className":["token","operator"]},"children":[{"type":"text","value":":"}]},{"type":"text","value":" "},{"type":"element","tag":"span","props":{"className":["token","string"]},"children":[{"type":"text","value":"\"nuxt generate\""}]},{"type":"text","value":"\n"}]}]}]},{"type":"text","value":"\n"},{"type":"element","tag":"prose-paragraph","props":{},"children":[{"type":"text","value":"La seconde consiste à ajouter un fichier "},{"type":"element","tag":"prose-code-inline","props":{},"children":[{"type":"text","value":"routes.json"}]},{"type":"text","value":" qui est important pour capturer les pages 404 personnalisées et les pages de secours du SPA."}]},{"type":"text","value":"\n"},{"type":"element","tag":"prose-paragraph","props":{},"children":[{"type":"element","tag":"prose-code-inline","props":{},"children":[{"type":"text","value":"static/routes.json"}]}]},{"type":"text","value":"\n"},{"type":"element","tag":"prose-code","props":{},"children":[{"type":"element","tag":"pre","props":{"className":["line-numbers","language-jsx"]},"children":[{"type":"element","tag":"code","props":{},"children":[{"type":"element","tag":"span","props":{"className":["token","punctuation"]},"children":[{"type":"text","value":"{"}]},{"type":"text","value":"\n "},{"type":"element","tag":"span","props":{"className":["token","string"]},"children":[{"type":"text","value":"\"routes\""}]},{"type":"element","tag":"span","props":{"className":["token","operator"]},"children":[{"type":"text","value":":"}]},{"type":"text","value":" "},{"type":"element","tag":"span","props":{"className":["token","punctuation"]},"children":[{"type":"text","value":"["}]},{"type":"element","tag":"span","props":{"className":["token","punctuation"]},"children":[{"type":"text","value":"]"}]},{"type":"element","tag":"span","props":{"className":["token","punctuation"]},"children":[{"type":"text","value":","}]},{"type":"text","value":"\n "},{"type":"element","tag":"span","props":{"className":["token","string"]},"children":[{"type":"text","value":"\"platformErrorOverrides\""}]},{"type":"element","tag":"span","props":{"className":["token","operator"]},"children":[{"type":"text","value":":"}]},{"type":"text","value":" "},{"type":"element","tag":"span","props":{"className":["token","punctuation"]},"children":[{"type":"text","value":"["}]},{"type":"text","value":"\n   "},{"type":"element","tag":"span","props":{"className":["token","punctuation"]},"children":[{"type":"text","value":"{"}]},{"type":"text","value":"\n    "},{"type":"element","tag":"span","props":{"className":["token","string"]},"children":[{"type":"text","value":"\"errorType\""}]},{"type":"element","tag":"span","props":{"className":["token","operator"]},"children":[{"type":"text","value":":"}]},{"type":"text","value":" "},{"type":"element","tag":"span","props":{"className":["token","string"]},"children":[{"type":"text","value":"\"NotFound\""}]},{"type":"element","tag":"span","props":{"className":["token","punctuation"]},"children":[{"type":"text","value":","}]},{"type":"text","value":"\n    "},{"type":"element","tag":"span","props":{"className":["token","string"]},"children":[{"type":"text","value":"\"serve\""}]},{"type":"element","tag":"span","props":{"className":["token","operator"]},"children":[{"type":"text","value":":"}]},{"type":"text","value":" "},{"type":"element","tag":"span","props":{"className":["token","string"]},"children":[{"type":"text","value":"\"/200.html\""}]},{"type":"element","tag":"span","props":{"className":["token","punctuation"]},"children":[{"type":"text","value":","}]},{"type":"text","value":"\n    "},{"type":"element","tag":"span","props":{"className":["token","string"]},"children":[{"type":"text","value":"\"statusCode\""}]},{"type":"element","tag":"span","props":{"className":["token","operator"]},"children":[{"type":"text","value":":"}]},{"type":"text","value":" "},{"type":"element","tag":"span","props":{"className":["token","number"]},"children":[{"type":"text","value":"200"}]},{"type":"text","value":"\n   "},{"type":"element","tag":"span","props":{"className":["token","punctuation"]},"children":[{"type":"text","value":"}"}]},{"type":"text","value":"\n "},{"type":"element","tag":"span","props":{"className":["token","punctuation"]},"children":[{"type":"text","value":"]"}]},{"type":"text","value":"\n"},{"type":"element","tag":"span","props":{"className":["token","punctuation"]},"children":[{"type":"text","value":"}"}]},{"type":"text","value":"\n"}]}]}]},{"type":"text","value":"\n"},{"type":"element","tag":"prose-paragraph","props":{},"children":[{"type":"text","value":"Si vous souhaitez tester le déploiement sur des applications Web statiques Azure, nous avons créé une petite application de démonstration entièrement installée et configurée. Vous aurez juste besoin de le cloner et de l'ajouter à votre dépôt GitHub. Vous pouvez ensuite suivre les étapes de - Déploiement de votre application avec Azure Static Web Apps."}]},{"type":"text","value":"\n"},{"type":"element","tag":"prose-paragraph","props":{},"children":[{"type":"element","tag":"prose-a","props":{"href":"https://github.com/debs-obrien/nuxtjs-azure-static-app","rel":["nofollow","noopener","noreferrer"],"target":"_blank"},"children":[{"type":"text","value":"Cloner l'application de démonstration"}]}]},{"type":"text","value":"\n"},{"type":"element","tag":"prose-h2","props":{"id":"déploiement-de-votre-application-avec-azure-static-web-apps"},"children":[{"type":"element","tag":"prose-a","props":{"href":"#d%C3%A9ploiement-de-votre-application-avec-azure-static-web-apps"},"children":[{"type":"text","value":"Déploiement de votre application avec Azure Static Web Apps"}]}]},{"type":"text","value":"\n"},{"type":"element","tag":"prose-h3","props":{"id":"étape-1--créez-des-applications-web-statiques-azure"},"children":[{"type":"element","tag":"prose-a","props":{"href":"#%C3%A9tape-1--cr%C3%A9ez-des-applications-web-statiques-azure"},"children":[{"type":"text","value":"Étape 1 : "},{"type":"element","tag":"prose-strong","props":{},"children":[{"type":"text","value":"Créez des applications Web statiques Azure"}]}]}]},{"type":"text","value":"\n"},{"type":"element","tag":"prose-ol","props":{},"children":[{"type":"text","value":"\n"},{"type":"element","tag":"prose-li","props":{},"children":[{"type":"text","value":"\n"},{"type":"text","value":"Accédez au "},{"type":"element","tag":"prose-a","props":{"href":"https://portal.azure.com/","rel":["nofollow","noopener","noreferrer"],"target":"_blank"},"children":[{"type":"text","value":"Portail Azure"}]},{"type":"text","value":"."},{"type":"text","value":"\n"}]},{"type":"text","value":"\n"},{"type":"element","tag":"prose-li","props":{},"children":[{"type":"text","value":"\n"},{"type":"text","value":"Cliquez sur "},{"type":"element","tag":"prose-strong","props":{},"children":[{"type":"text","value":"Créer une ressource"}]},{"type":"text","value":", puis recherchez "},{"type":"element","tag":"prose-strong","props":{},"children":[{"type":"text","value":"Application statique"}]},{"type":"text","value":" et sélectionnez-la."},{"type":"text","value":"\n"}]},{"type":"text","value":"\n"},{"type":"element","tag":"prose-li","props":{},"children":[{"type":"text","value":"\n"},{"type":"text","value":"Sélectionnez un abonnement dans la liste déroulante "},{"type":"element","tag":"prose-em","props":{},"children":[{"type":"text","value":"Abonnement"}]},{"type":"text","value":" ou utilisez celui par défaut."},{"type":"text","value":"\n"}]},{"type":"text","value":"\n"},{"type":"element","tag":"prose-li","props":{},"children":[{"type":"text","value":"\n"},{"type":"text","value":"Cliquez sur le lien "},{"type":"element","tag":"prose-strong","props":{},"children":[{"type":"text","value":"Nouveau"}]},{"type":"text","value":" sous la liste déroulante "},{"type":"element","tag":"prose-em","props":{},"children":[{"type":"text","value":"Groupe de ressources"}]},{"type":"text","value":". Dans "},{"type":"element","tag":"prose-em","props":{},"children":[{"type":"text","value":"Nom du nouveau groupe de ressources"}]},{"type":"text","value":", saisissez "},{"type":"element","tag":"prose-strong","props":{},"children":[{"type":"text","value":"nuxt"}]},{"type":"text","value":" et cliquez sur "},{"type":"element","tag":"prose-strong","props":{},"children":[{"type":"text","value":"OK"}]},{"type":"text","value":"\n"}]},{"type":"text","value":"\n"},{"type":"element","tag":"prose-li","props":{},"children":[{"type":"text","value":"\n"},{"type":"text","value":"Fournissez un nom unique pour votre application dans la zone de texte "},{"type":"element","tag":"prose-strong","props":{},"children":[{"type":"text","value":"Nom"}]},{"type":"text","value":". Les caractères valides incluent "},{"type":"element","tag":"prose-code-inline","props":{},"children":[{"type":"text","value":"a-z"}]},{"type":"text","value":", "},{"type":"element","tag":"prose-code-inline","props":{},"children":[{"type":"text","value":"A-Z"}]},{"type":"text","value":", "},{"type":"element","tag":"prose-code-inline","props":{},"children":[{"type":"text","value":"0-9"}]},{"type":"text","value":" et "},{"type":"element","tag":"prose-code-inline","props":{},"children":[{"type":"text","value":"-"}]},{"type":"text","value":". Le nom de l'application est utilisé pour identifier l'application dans votre liste de ressources, c'est donc une bonne idée de nommer votre application en utilisant le nom de votre projet."},{"type":"text","value":"\n"}]},{"type":"text","value":"\n"},{"type":"element","tag":"prose-li","props":{},"children":[{"type":"text","value":"\n"},{"type":"text","value":"Dans la liste déroulante "},{"type":"element","tag":"prose-em","props":{},"children":[{"type":"text","value":"Région"}]},{"type":"text","value":", choisissez une région la plus proche de vous."},{"type":"text","value":"\n"}]},{"type":"text","value":"\n"}]},{"type":"text","value":"\n"},{"type":"element","tag":"prose-paragraph","props":{},"children":[{"type":"element","tag":"prose-img","props":{"alt":"Configuration des ressources et de l'application du portail Azure","src":"https://user-images.githubusercontent.com/13063165/82118135-71891b00-9775-11ea-8284-aa94d17a3bc3.png"},"children":[]}]},{"type":"text","value":"\n"},{"type":"element","tag":"prose-h3","props":{"id":"étape-2-ajouter-un-dépôt-github"},"children":[{"type":"element","tag":"prose-a","props":{"href":"#%C3%A9tape-2-ajouter-un-d%C3%A9p%C3%B4t-github"},"children":[{"type":"text","value":"Étape 2: "},{"type":"element","tag":"prose-strong","props":{},"children":[{"type":"text","value":"Ajouter un dépôt GitHub"}]}]}]},{"type":"text","value":"\n"},{"type":"element","tag":"prose-paragraph","props":{},"children":[{"type":"text","value":"L'application statique Azure App Service a besoin d'accéder au dépôt où réside votre application Nuxt afin qu'elle puisse déployer automatiquement des commits :"}]},{"type":"text","value":"\n"},{"type":"element","tag":"prose-ol","props":{},"children":[{"type":"text","value":"\n"},{"type":"element","tag":"prose-li","props":{},"children":[{"type":"text","value":"\n"},{"type":"text","value":"Cliquez sur le bouton "},{"type":"element","tag":"prose-strong","props":{},"children":[{"type":"text","value":"Se connecter avec GitHub"}]},{"type":"text","value":"\n"}]},{"type":"text","value":"\n"},{"type":"element","tag":"prose-li","props":{},"children":[{"type":"text","value":"\n"},{"type":"text","value":"Sélectionnez l'"},{"type":"element","tag":"prose-strong","props":{},"children":[{"type":"text","value":"Organisation"}]},{"type":"text","value":" sous laquelle vous avez créé le dépôt pour votre projet Nuxt. Il peut également s'agir de votre nom d'utilisateur GitHub."},{"type":"text","value":"\n"}]},{"type":"text","value":"\n"},{"type":"element","tag":"prose-li","props":{},"children":[{"type":"text","value":"\n"},{"type":"text","value":"Recherchez le nom du dépôt que vous avez créé précédemment et sélectionnez-le."},{"type":"text","value":"\n"}]},{"type":"text","value":"\n"},{"type":"element","tag":"prose-li","props":{},"children":[{"type":"text","value":"\n"},{"type":"text","value":"Choisissez "},{"type":"element","tag":"prose-strong","props":{},"children":[{"type":"text","value":"master"}]},{"type":"text","value":" comme branche dans la liste déroulante "},{"type":"element","tag":"prose-em","props":{},"children":[{"type":"text","value":"Branche"}]},{"type":"text","value":"."},{"type":"text","value":"\n"}]},{"type":"text","value":"\n"}]},{"type":"text","value":"\n"},{"type":"element","tag":"prose-paragraph","props":{},"children":[{"type":"element","tag":"prose-img","props":{"alt":"Comment ajouter sur github","src":"https://user-images.githubusercontent.com/13063165/82118359-38ea4100-9777-11ea-9c5e-7ba5c4da708e.png"},"children":[]}]},{"type":"text","value":"\n"},{"type":"element","tag":"prose-h3","props":{"id":"étape-3-configurer-le-processus-de-construction"},"children":[{"type":"element","tag":"prose-a","props":{"href":"#%C3%A9tape-3-configurer-le-processus-de-construction"},"children":[{"type":"text","value":"Étape 3: "},{"type":"element","tag":"prose-strong","props":{},"children":[{"type":"text","value":"Configurer le processus de construction"}]}]}]},{"type":"text","value":"\n"},{"type":"element","tag":"prose-paragraph","props":{},"children":[{"type":"text","value":"Il y a des choses que l'application statique Azure App Service peut deviner - des choses comme l'installation automatique des modules npm et l'exécution de "},{"type":"element","tag":"prose-code-inline","props":{},"children":[{"type":"text","value":"npm run build"}]},{"type":"text","value":". Il y a aussi des choses sur lesquelles vous devez être explicite, comme le dossier dans lequel l'application statique sera copiée après la construction afin que le site statique puisse être servi à partir de là."}]},{"type":"text","value":"\n"},{"type":"element","tag":"prose-ol","props":{},"children":[{"type":"text","value":"\n"},{"type":"element","tag":"prose-li","props":{},"children":[{"type":"text","value":"\n"},{"type":"text","value":"Cliquez sur l'onglet "},{"type":"element","tag":"prose-strong","props":{},"children":[{"type":"text","value":"Construction"}]},{"type":"text","value":" pour configurer le dossier de sortie statique."},{"type":"text","value":"\n"}]},{"type":"text","value":"\n"},{"type":"element","tag":"prose-li","props":{},"children":[{"type":"text","value":"\n"},{"type":"text","value":"Saisissez "},{"type":"element","tag":"prose-strong","props":{},"children":[{"type":"text","value":"dist"}]},{"type":"text","value":" dans la zone de texte "},{"type":"element","tag":"prose-em","props":{},"children":[{"type":"text","value":"Emplacement de l'artefact de l'application"}]},{"type":"text","value":"."},{"type":"text","value":"\n"}]},{"type":"text","value":"\n"}]},{"type":"text","value":"\n"},{"type":"element","tag":"prose-paragraph","props":{},"children":[{"type":"element","tag":"prose-img","props":{"alt":"Configuration du portail Azure","src":"https://user-images.githubusercontent.com/13063165/82118277-71d5e600-9776-11ea-88ad-48cf0793905d.png"},"children":[]}]},{"type":"text","value":"\n"},{"type":"element","tag":"prose-h3","props":{"id":"étape-4-révisez-et-créez"},"children":[{"type":"element","tag":"prose-a","props":{"href":"#%C3%A9tape-4-r%C3%A9visez-et-cr%C3%A9ez"},"children":[{"type":"text","value":"Étape 4: "},{"type":"element","tag":"prose-strong","props":{},"children":[{"type":"text","value":"Révisez et créez"}]}]}]},{"type":"text","value":"\n"},{"type":"element","tag":"prose-ol","props":{},"children":[{"type":"text","value":"\n"},{"type":"element","tag":"prose-li","props":{},"children":[{"type":"text","value":"\n"},{"type":"text","value":"Cliquez sur le bouton "},{"type":"element","tag":"prose-strong","props":{},"children":[{"type":"text","value":"Réviser + Créer"}]},{"type":"text","value":" pour vérifier que tous les détails sont corrects."},{"type":"text","value":"\n"}]},{"type":"text","value":"\n"},{"type":"element","tag":"prose-li","props":{},"children":[{"type":"text","value":"\n"},{"type":"text","value":"Cliquez sur "},{"type":"element","tag":"prose-strong","props":{},"children":[{"type":"text","value":"Créer"}]},{"type":"text","value":" pour lancer la création de la ressource et également provisionner une action GitHub pour le déploiement."},{"type":"text","value":"\n"}]},{"type":"text","value":"\n"},{"type":"element","tag":"prose-li","props":{},"children":[{"type":"text","value":"\n"},{"type":"text","value":"Une fois le déploiement terminé, cliquez sur "},{"type":"element","tag":"prose-strong","props":{},"children":[{"type":"text","value":"Aller à la ressource"}]},{"type":"text","value":"\n"}]},{"type":"text","value":"\n"}]},{"type":"text","value":"\n"},{"type":"element","tag":"prose-paragraph","props":{},"children":[{"type":"element","tag":"prose-img","props":{"alt":"Message de fin de déploiement du portail Azure","src":"https://user-images.githubusercontent.com/13063165/82118390-67681c00-9777-11ea-9778-671dc768393e.png"},"children":[]}]},{"type":"text","value":"\n"},{"type":"element","tag":"prose-ol","props":{"start":4},"children":[{"type":"text","value":"\n"},{"type":"element","tag":"prose-li","props":{},"children":[{"type":"text","value":"\n"},{"type":"text","value":"Sur l'écran des ressources, cliquez sur le lien "},{"type":"element","tag":"prose-em","props":{},"children":[{"type":"text","value":"URL"}]},{"type":"text","value":" pour ouvrir votre application déployée."},{"type":"text","value":"\n"}]},{"type":"text","value":"\n"}]},{"type":"text","value":"\n"},{"type":"element","tag":"prose-paragraph","props":{},"children":[{"type":"element","tag":"prose-img","props":{"alt":"resource screen with url to your deployed app","src":"https://user-images.githubusercontent.com/13063165/82118042-d001c980-9774-11ea-94f5-57d995aa5391.png"},"children":[]}]},{"type":"text","value":"\n"},{"type":"element","tag":"prose-paragraph","props":{},"children":[{"type":"text","value":"Félicitations, votre site statique est désormais hébergé sur des applications web statiques Azure."}]},{"type":"text","value":"\n"},{"type":"element","tag":"prose-h2","props":{"id":"reconstruisez-votre-application-statique-en-surveillant-votre-déploiement"},"children":[{"type":"element","tag":"prose-a","props":{"href":"#reconstruisez-votre-application-statique-en-surveillant-votre-d%C3%A9ploiement"},"children":[{"type":"text","value":"Reconstruisez votre application statique en surveillant votre déploiement"}]}]},{"type":"text","value":"\n"},{"type":"element","tag":"prose-paragraph","props":{},"children":[{"type":"text","value":"Maintenant, tout ce que vous avez à faire est de modifier votre code et de pousser vos modifications. Pousser vos modifications activera une action GitHub et votre nouveau site sera automatiquement reconstruit. Vous pouvez surveiller le flux de travail en cliquant sur l'onglet actions dans votre projet GitHub et inspecter davantage en sélectionnant le dernier commit que vous avez effectué. Vous pouvez ensuite regarder pour voir quand le déploiement est terminé ou inspecter le journal si vous avez des erreurs de déploiement."}]},{"type":"text","value":"\n"},{"type":"element","tag":"prose-paragraph","props":{},"children":[{"type":"element","tag":"prose-img","props":{"alt":"Écran d'action GitHub","src":"https://user-images.githubusercontent.com/13063165/82118249-34715880-9776-11ea-92e2-dbd21bbf7cb6.png"},"children":[]}]},{"type":"text","value":"\n"},{"type":"element","tag":"prose-h2","props":{"id":"le-saviez-vous-"},"children":[{"type":"element","tag":"prose-a","props":{"href":"#le-saviez-vous-"},"children":[{"type":"text","value":"Le saviez-vous ?"}]}]},{"type":"text","value":"\n"},{"type":"element","tag":"prose-h3","props":{"id":"comment-gérer-les-routes-dynamiques"},"children":[{"type":"element","tag":"prose-a","props":{"href":"#comment-g%C3%A9rer-les-routes-dynamiques"},"children":[{"type":"element","tag":"prose-strong","props":{},"children":[{"type":"text","value":"Comment gérer les routes dynamiques"}]}]}]},{"type":"text","value":"\n"},{"type":"element","tag":"prose-paragraph","props":{},"children":[{"type":"text","value":"Si vous travaillez avec des pages dynamiques telles que "},{"type":"element","tag":"prose-code-inline","props":{},"children":[{"type":"text","value":"_id.vue"}]},{"type":"text","value":", vous devrez alors ajouter ces routes à la propriété generate dans votre configuration nuxt."}]},{"type":"text","value":"\n"},{"type":"element","tag":"prose-paragraph","props":{},"children":[{"type":"element","tag":"prose-a","props":{"href":"/docs/configuration-glossary/configuration-generate#routes"},"children":[{"type":"text","value":"Voir la documentation sur la façon de gérer les routes dynamiques."}]}]},{"type":"text","value":"\n"},{"type":"element","tag":"div","props":{"className":["Alert"]},"children":[{"type":"text","value":"\nSi vous utilisez Nuxt 2.13+, vous n'aurez pas à vous en soucier car il existe un robot d'exploration intégré qui explorera toutes les dynamiques en explorant les liens de votre site.\n"}]},{"type":"text","value":"\n"},{"type":"element","tag":"prose-h3","props":{"id":"comment-ajouter-une-page-derreur"},"children":[{"type":"element","tag":"prose-a","props":{"href":"#comment-ajouter-une-page-derreur"},"children":[{"type":"text","value":"Comment ajouter une page d'erreur"}]}]},{"type":"text","value":"\n"},{"type":"element","tag":"prose-paragraph","props":{},"children":[{"type":"text","value":"Dans le but de ne pas avoir la page 404 par défaut, vous pouvez créer un fichier "},{"type":"element","tag":"prose-code-inline","props":{},"children":[{"type":"text","value":"error.vue"}]},{"type":"text","value":" dans votre dossier layouts."}]},{"type":"text","value":"\n"},{"type":"element","tag":"prose-h3","props":{"id":"comment-ajouter-une-solution-de-repli"},"children":[{"type":"element","tag":"prose-a","props":{"href":"#comment-ajouter-une-solution-de-repli"},"children":[{"type":"text","value":"Comment ajouter une solution de repli"}]}]},{"type":"text","value":"\n"},{"type":"element","tag":"prose-paragraph","props":{},"children":[{"type":"text","value":"Si vous souhaitez que certaines pages ne soient pas générées mais agissent comme une application à page unique, vous pouvez le faire en utilisant la propriété generate.excludes dans votre fichier nuxt.config."}]},{"type":"text","value":"\n"},{"type":"element","tag":"prose-paragraph","props":{},"children":[{"type":"element","tag":"prose-a","props":{"href":"/docs/configuration-glossary/configuration-generate#exclude"},"children":[{"type":"text","value":"Voir la documentation sur les solutions de repli du SPA"}]}]}]},"toc":{"title":"","searchDepth":2,"depth":2,"links":[{"id":"déploiement-de-votre-application-avec-azure-static-web-apps","depth":2,"text":"Déploiement de votre application avec Azure Static Web Apps","children":[{"id":"étape-1--créez-des-applications-web-statiques-azure","depth":3,"text":"Étape 1 : Créez des applications Web statiques Azure"},{"id":"étape-2-ajouter-un-dépôt-github","depth":3,"text":"Étape 2: Ajouter un dépôt GitHub"},{"id":"étape-3-configurer-le-processus-de-construction","depth":3,"text":"Étape 3: Configurer le processus de construction"},{"id":"étape-4-révisez-et-créez","depth":3,"text":"Étape 4: Révisez et créez"}]},{"id":"reconstruisez-votre-application-statique-en-surveillant-votre-déploiement","depth":2,"text":"Reconstruisez votre application statique en surveillant votre déploiement"},{"id":"le-saviez-vous-","depth":2,"text":"Le saviez-vous ?","children":[{"id":"comment-gérer-les-routes-dynamiques","depth":3,"text":"Comment gérer les routes dynamiques"},{"id":"comment-ajouter-une-page-derreur","depth":3,"text":"Comment ajouter une page d'erreur"},{"id":"comment-ajouter-une-solution-de-repli","depth":3,"text":"Comment ajouter une solution de repli"}]}]}}}