{"key":"content:fr:_collections:navigations:header.md","generatedAt":"2022-03-15T12:42:46.410Z","mtime":"2022-03-15T12:42:46.409Z","slug":"header","title":"Header","position":"999999999999","to":"/collections/navigations/header","draft":false,"page":false,"language":"fr","links":[{"title":"Découvrir","items":[{"title":"Showcases","subtitle":"Sélection de sites créés avec Nuxt","slug":"showcases","to":"/showcases","icon":"showcases.svg","color":"bg-sand"},{"title":"Étude de cas","subtitle":"Comment Nuxt est utilisé par les entreprises","slug":"case-studies","to":"/case-studies","icon":"case-studies.svg","color":"bg-sand-dark"},{"title":"Témoignages","subtitle":"Ce qu'ils pensent de nous","slug":"testimonials","to":"/testimonials","icon":"testimonials.svg","color":"bg-sand-darker"}]},{"title":"Apprendre","items":[{"title":"Docs","subtitle":"Créez un site web facilement","slug":"docs","to":"/docs","icon":"docs.svg","color":"bg-green-500"},{"title":"Exemples","subtitle":"Comprendre tout sur Nuxt","slug":"examples","to":"/examples","icon":"examples.svg","color":"bg-green-600"},{"title":"Tutoriels","subtitle":"Apprenez avec des cas concrets","slug":"tutorials","to":"/tutorials","icon":"tutorials.svg","color":"bg-green-700"},{"title":"Master courses","subtitle":"Apprenez en plus grâce aux experts","href":"https://masteringnuxt.com/?utm_source=nuxt&utm_medium=link&utm_campaign=nsite","icon":"master-courses.svg","color":"bg-green-800"}]},{"title":"Explorer","items":[{"title":"Déploiements","subtitle":"Comment déployer Nuxt","slug":"deployments","to":"/deployments","icon":"deployments.svg","color":"bg-indigo-light"},{"title":"Modules","subtitle":"Toute la puissance de Nuxt","href":"https://modules.nuxtjs.org","icon":"modules.svg","color":"bg-indigo"},{"title":"Thèmes","subtitle":"Commencez avec les thèmes","slug":"themes","to":"/themes","icon":"themes.svg","color":"bg-indigo-dark"},{"title":"Cours vidéo","subtitle":"Apprendre étape par étape","slug":"video-courses","to":"/video-courses","icon":"video-courses.svg","color":"bg-indigo-darker"}]},{"title":"Communauté","items":[{"title":"Annonces","subtitle":"Les dernières nouvelles concernant Nuxt","slug":"announcements","to":"/announcements","icon":"announcements.svg","color":"bg-mint-lighter"},{"title":"Équipes","subtitle":"Nous sommes Nuxt","slug":"teams","to":"/teams","icon":"teams.svg","color":"bg-mint-light"},{"title":"Notes de version","subtitle":"Tout le code que nous avons publié","slug":"releases","to":"/releases","icon":"releases.svg","color":"bg-mint"},{"title":"Sponsors","subtitle":"Ils croient en nous","slug":"sponsors","to":"/sponsors","icon":"sponsors.svg","color":"bg-mint-dark"}]},{"title":"Partenaires","slug":"partners","to":"/partners"}],"empty":true,"description":"","body":{"raw":"---\nlinks:\n  - title: 'Découvrir'\n    items:\n      - title: 'Showcases'\n        subtitle: 'Sélection de sites créés avec Nuxt'\n        slug: 'showcases'\n        to: '/showcases'\n        icon: 'showcases.svg'\n        color: 'bg-sand'\n      - title: 'Étude de cas'\n        subtitle: 'Comment Nuxt est utilisé par les entreprises'\n        slug: 'case-studies'\n        to: '/case-studies'\n        icon: 'case-studies.svg'\n        color: 'bg-sand-dark'\n      - title: 'Témoignages'\n        subtitle: \"Ce qu'ils pensent de nous\"\n        slug: 'testimonials'\n        to: '/testimonials'\n        icon: 'testimonials.svg'\n        color: 'bg-sand-darker'\n  - title: 'Apprendre'\n    items:\n      - title: 'Docs'\n        subtitle: 'Créez un site web facilement'\n        slug: 'docs'\n        to: '/docs'\n        icon: 'docs.svg'\n        color: 'bg-green-500'\n      - title: 'Exemples'\n        subtitle: 'Comprendre tout sur Nuxt'\n        slug: 'examples'\n        to: '/examples'\n        icon: 'examples.svg'\n        color: 'bg-green-600'\n      - title: 'Tutoriels'\n        subtitle: 'Apprenez avec des cas concrets'\n        slug: 'tutorials'\n        to: '/tutorials'\n        icon: 'tutorials.svg'\n        color: 'bg-green-700'\n      - title: 'Master courses'\n        subtitle: 'Apprenez en plus grâce aux experts'\n        href: 'https://masteringnuxt.com/?utm_source=nuxt&utm_medium=link&utm_campaign=nsite'\n        icon: 'master-courses.svg'\n        color: 'bg-green-800'\n  - title: 'Explorer'\n    items:\n      - title: 'Déploiements'\n        subtitle: 'Comment déployer Nuxt'\n        slug: 'deployments'\n        to: '/deployments'\n        icon: 'deployments.svg'\n        color: 'bg-indigo-light'\n      - title: 'Modules'\n        subtitle: 'Toute la puissance de Nuxt'\n        href: 'https://modules.nuxtjs.org'\n        icon: 'modules.svg'\n        color: 'bg-indigo'\n      - title: 'Thèmes'\n        subtitle: 'Commencez avec les thèmes'\n        slug: 'themes'\n        to: '/themes'\n        icon: 'themes.svg'\n        color: 'bg-indigo-dark'\n      - title: 'Cours vidéo'\n        subtitle: 'Apprendre étape par étape'\n        slug: 'video-courses'\n        to: '/video-courses'\n        icon: 'video-courses.svg'\n        color: 'bg-indigo-darker'\n  - title: 'Communauté'\n    items:\n      - title: 'Annonces'\n        subtitle: 'Les dernières nouvelles concernant Nuxt'\n        slug: 'announcements'\n        to: '/announcements'\n        icon: 'announcements.svg'\n        color: 'bg-mint-lighter'\n      - title: 'Équipes'\n        subtitle: 'Nous sommes Nuxt'\n        slug: 'teams'\n        to: '/teams'\n        icon: 'teams.svg'\n        color: 'bg-mint-light'\n      - title: 'Notes de version'\n        subtitle: 'Tout le code que nous avons publié'\n        slug: 'releases'\n        to: '/releases'\n        icon: 'releases.svg'\n        color: 'bg-mint'\n      - title: 'Sponsors'\n        subtitle: 'Ils croient en nous'\n        slug: 'sponsors'\n        to: '/sponsors'\n        icon: 'sponsors.svg'\n        color: 'bg-mint-dark'\n  - title: 'Partenaires'\n    slug: 'partners'\n    to: '/partners'\n---\n","ast":{"type":"root","children":[]},"toc":{"title":"","searchDepth":2,"depth":2,"links":[]}}}