{"key":"content:ja:_collections:navigations:header.md","generatedAt":"2022-03-15T12:42:48.577Z","mtime":"2022-03-15T12:42:48.576Z","slug":"header","title":"Header","position":"999999999999","to":"/collections/navigations/header","draft":false,"page":false,"language":"ja","links":[{"title":"見る","items":[{"title":"導入事例","subtitle":"Nuxt で作られた Web サイトセレクション","slug":"showcases","to":"/showcases","icon":"showcases.svg","color":"bg-sand"},{"title":"事例紹介","subtitle":"企業による Nuxt の活用方法","slug":"case-studies","to":"/case-studies","icon":"case-studies.svg","color":"bg-sand-dark"},{"title":"著名人の声","subtitle":"私たちのことをどう思っているのか","slug":"testimonials","to":"/testimonials","icon":"testimonials.svg","color":"bg-sand-darker"}]},{"title":"学ぶ","items":[{"title":"ドキュメント","subtitle":"高速な Web サイトを簡単に作成する","slug":"docs","to":"/docs","icon":"docs.svg","color":"bg-green-500"},{"title":"例","subtitle":"Nuxt のすべてを理解する","slug":"examples","to":"/examples","icon":"examples.svg","color":"bg-green-600"},{"title":"チュートリアル","subtitle":"具体的なケースで学習する","slug":"tutorials","to":"/tutorials","icon":"tutorials.svg","color":"bg-green-700"},{"title":"マスターコース","subtitle":"エキスパートといっしょにもっと学習する","href":"https://masteringnuxt.com/?utm_source=nuxt&utm_medium=link&utm_campaign=nsite","icon":"master-courses.svg","color":"bg-green-800"}]},{"title":"探す","items":[{"title":"デプロイ","subtitle":"Nuxt のデプロイの仕方","slug":"deployments","to":"/deployments","icon":"deployments.svg","color":"bg-indigo-light"},{"title":"モジュール","subtitle":"Nuxt のパワーを拡張する","href":"https://modules.nuxtjs.org","icon":"modules.svg","color":"bg-indigo"},{"title":"テーマ","subtitle":"テーマで始める","slug":"themes","to":"/themes","icon":"themes.svg","color":"bg-indigo-dark"},{"title":"ビデオコース","subtitle":"ステップバイステップで学習する","slug":"video-courses","to":"/video-courses","icon":"video-courses.svg","color":"bg-indigo-darker"}]},{"title":"コミュニティ","items":[{"title":"お知らせ","subtitle":"Nuxt について最新ニュース","slug":"announcements","to":"/announcements","icon":"announcements.svg","color":"bg-mint-lighter"},{"title":"チーム","subtitle":"They are Nuxt","slug":"teams","to":"/teams","icon":"teams.svg","color":"bg-mint-light"},{"title":"リリース","subtitle":"私たちがリリースしたすべてのコード","slug":"releases","to":"/releases","icon":"releases.svg","color":"bg-mint"},{"title":"スポンサー","subtitle":"私たちを信頼しています","slug":"sponsors","to":"/sponsors","icon":"sponsors.svg","color":"bg-mint-dark"}]},{"title":"パートナー","slug":"partners","to":"/partners"}],"empty":true,"description":"","body":{"raw":"---\nlinks:\n  - title: '見る'\n    items:\n      - title: '導入事例'\n        subtitle: 'Nuxt で作られた Web サイトセレクション'\n        slug: 'showcases'\n        to: '/showcases'\n        icon: 'showcases.svg'\n        color: 'bg-sand'\n      - title: '事例紹介'\n        subtitle: '企業による Nuxt の活用方法'\n        slug: 'case-studies'\n        to: '/case-studies'\n        icon: 'case-studies.svg'\n        color: 'bg-sand-dark'\n      - title: '著名人の声'\n        subtitle: '私たちのことをどう思っているのか'\n        slug: 'testimonials'\n        to: '/testimonials'\n        icon: 'testimonials.svg'\n        color: 'bg-sand-darker'\n  - title: '学ぶ'\n    items:\n      - title: 'ドキュメント'\n        subtitle: '高速な Web サイトを簡単に作成する'\n        slug: 'docs'\n        to: '/docs'\n        icon: 'docs.svg'\n        color: 'bg-green-500'\n      - title: '例'\n        subtitle: 'Nuxt のすべてを理解する'\n        slug: 'examples'\n        to: '/examples'\n        icon: 'examples.svg'\n        color: 'bg-green-600'\n      - title: 'チュートリアル'\n        subtitle: '具体的なケースで学習する'\n        slug: 'tutorials'\n        to: '/tutorials'\n        icon: 'tutorials.svg'\n        color: 'bg-green-700'\n      - title: 'マスターコース'\n        subtitle: 'エキスパートといっしょにもっと学習する'\n        href: 'https://masteringnuxt.com/?utm_source=nuxt&utm_medium=link&utm_campaign=nsite'\n        icon: 'master-courses.svg'\n        color: 'bg-green-800'\n  - title: '探す'\n    items:\n      - title: 'デプロイ'\n        subtitle: 'Nuxt のデプロイの仕方'\n        slug: 'deployments'\n        to: '/deployments'\n        icon: 'deployments.svg'\n        color: 'bg-indigo-light'\n      - title: 'モジュール'\n        subtitle: 'Nuxt のパワーを拡張する'\n        href: 'https://modules.nuxtjs.org'\n        icon: 'modules.svg'\n        color: 'bg-indigo'\n      - title: 'テーマ'\n        subtitle: 'テーマで始める'\n        slug: 'themes'\n        to: '/themes'\n        icon: 'themes.svg'\n        color: 'bg-indigo-dark'\n      - title: 'ビデオコース'\n        subtitle: 'ステップバイステップで学習する'\n        slug: 'video-courses'\n        to: '/video-courses'\n        icon: 'video-courses.svg'\n        color: 'bg-indigo-darker'\n  - title: 'コミュニティ'\n    items:\n      - title: 'お知らせ'\n        subtitle: 'Nuxt について最新ニュース'\n        slug: 'announcements'\n        to: '/announcements'\n        icon: 'announcements.svg'\n        color: 'bg-mint-lighter'\n      - title: 'チーム'\n        subtitle: 'They are Nuxt'\n        slug: 'teams'\n        to: '/teams'\n        icon: 'teams.svg'\n        color: 'bg-mint-light'\n      - title: 'リリース'\n        subtitle: '私たちがリリースしたすべてのコード'\n        slug: 'releases'\n        to: '/releases'\n        icon: 'releases.svg'\n        color: 'bg-mint'\n      - title: 'スポンサー'\n        subtitle: '私たちを信頼しています'\n        slug: 'sponsors'\n        to: '/sponsors'\n        icon: 'sponsors.svg'\n        color: 'bg-mint-dark'\n  - title: 'パートナー'\n    slug: 'partners'\n    to: '/partners'\n---\n","ast":{"type":"root","children":[]},"toc":{"title":"","searchDepth":2,"depth":2,"links":[]}}}