{"key":"content:ja:teams:index.md","generatedAt":"2022-03-15T12:42:48.181Z","mtime":"2022-03-15T12:42:48.179Z","slug":"","title":"Teams","position":"999999990000","to":"/teams","draft":false,"page":true,"language":"ja","template":"blank","description":"The development of Nuxt is led by an international team. Our committed team works every day to move Nuxt forward.","layout":{"fluid":true},"navigation":false,"empty":false,"body":{"raw":"---\ntemplate: blank\ntitle: 'Teams'\ndescription: 'The development of Nuxt is led by an international team. Our committed team works every day to move Nuxt forward.'\nlayout:\n  fluid: true\nnavigation: false\n---\n\n::page-hero\n#title\nNuxt チーム\n\n#description\nNuxt とそのエコシステムの開発は国際チームよって主導しています。私たちのコミットチームは、Nuxt をより前進させるために毎日開発しています。\n::\n\n::team-section\n---\nteamName: framework\n---\n#title\n[フレームワーク]{.text-primary}チーム\n::\n\n::team-section\n---\nteamName: community\n---\n#title\n[コミュニティ]{.text-primary}チーム\n#description\nコントリビューターからアドボケーターまで、コミュニティは様々な分野やスキルを持ったメンバーで構成されています。私たちは毎日新しいメンバーに会えることはうれしいですし、誰でもどんな形（質問に答えたり、講演をしたり、モジュールを作成したり、コアに貢献したり）でも、手助けすることができます。\n::\n","ast":{"type":"root","children":[{"type":"element","tag":"page-hero","props":{},"children":[{"type":"element","tag":"template","props":{"v-slot:title":""},"children":[{"type":"element","tag":"prose-paragraph","props":{},"children":[{"type":"text","value":"Nuxt チーム"}]}],"content":[{"type":"element","tag":"prose-paragraph","props":{},"children":[{"type":"text","value":"Nuxt チーム"}]}]},{"type":"element","tag":"template","props":{"v-slot:description":""},"children":[{"type":"element","tag":"prose-paragraph","props":{},"children":[{"type":"text","value":"Nuxt とそのエコシステムの開発は国際チームよって主導しています。私たちのコミットチームは、Nuxt をより前進させるために毎日開発しています。"}]}],"content":[{"type":"element","tag":"prose-paragraph","props":{},"children":[{"type":"text","value":"Nuxt とそのエコシステムの開発は国際チームよって主導しています。私たちのコミットチームは、Nuxt をより前進させるために毎日開発しています。"}]}]}]},{"type":"text","value":"\n"},{"type":"element","tag":"team-section","props":{"teamName":"framework"},"children":[{"type":"element","tag":"template","props":{"v-slot:title":""},"children":[{"type":"element","tag":"prose-paragraph","props":{},"children":[{"type":"element","tag":"span","props":{"className":["text-primary"]},"children":[{"type":"text","value":"フレームワーク"}]},{"type":"text","value":"チーム"}]}],"content":[{"type":"element","tag":"prose-paragraph","props":{},"children":[{"type":"element","tag":"span","props":{"className":["text-primary"]},"children":[{"type":"text","value":"フレームワーク"}]},{"type":"text","value":"チーム"}]}]}]},{"type":"text","value":"\n"},{"type":"element","tag":"team-section","props":{"teamName":"community"},"children":[{"type":"element","tag":"template","props":{"v-slot:title":""},"children":[{"type":"element","tag":"prose-paragraph","props":{},"children":[{"type":"element","tag":"span","props":{"className":["text-primary"]},"children":[{"type":"text","value":"コミュニティ"}]},{"type":"text","value":"チーム"}]}],"content":[{"type":"element","tag":"prose-paragraph","props":{},"children":[{"type":"element","tag":"span","props":{"className":["text-primary"]},"children":[{"type":"text","value":"コミュニティ"}]},{"type":"text","value":"チーム"}]}]},{"type":"element","tag":"template","props":{"v-slot:description":""},"children":[{"type":"element","tag":"prose-paragraph","props":{},"children":[{"type":"text","value":"コントリビューターからアドボケーターまで、コミュニティは様々な分野やスキルを持ったメンバーで構成されています。私たちは毎日新しいメンバーに会えることはうれしいですし、誰でもどんな形（質問に答えたり、講演をしたり、モジュールを作成したり、コアに貢献したり）でも、手助けすることができます。"}]}],"content":[{"type":"element","tag":"prose-paragraph","props":{},"children":[{"type":"text","value":"コントリビューターからアドボケーターまで、コミュニティは様々な分野やスキルを持ったメンバーで構成されています。私たちは毎日新しいメンバーに会えることはうれしいですし、誰でもどんな形（質問に答えたり、講演をしたり、モジュールを作成したり、コアに貢献したり）でも、手助けすることができます。"}]}]}]}]},"toc":{"title":"","searchDepth":2,"depth":2,"links":[]}}}